language,script,country,region_dialect,source_type,source_ref,collection_date,text,domain,topic,theme,sensitive_characteristic,safety_flag,pii_removed,collector_id
Hausa,latin,Nigeria,Standard,web_public,https://munbarin-musulunci.blogspot.com/,2026-03-04,Ma'ana: Kuma a lokacin da wata tawaga daga cikinsu (su munamukai sukace) Ya ku mutanan Yasriba baku da matsaya ku koma…,culture_and_religion,Yasriba community,public_interest,,safe,false,
Hausa,latin,Nigeria,Kano,web_public,https://gidanlabarai.blogspot.com/,2026-03-06,"which help ma xaka iya rendering dinta tukun, taking her to psychiatry nd staying with her there ko yaya?"" Junaid ya tabe baki yace ""Ae dan Mumy da Abba baxa su yrda bne da nayi hkn wllh"" El-Ameen yyi dariya sosai yace ""Ehh lallai Junaid ka ja ma kanka"" Junaid yyi kasa da murya yace ""Listen to me plss Dr, ban da kai akwae wanda xan kai ma damuwar da na k'asa gaya ma mahaifiyata duk kusanci na da ita, why kake min hka frnd?"" El-Ameen ya sauke ajiyar xuciya yace ""Noo ba hka ba Junaid, ynxu tell me ya kake son ayi, hw did yhu want me to help in here?"" Cikin kwantar da murya junaid yace ""yhu are a Neurologist as well as a qualified MD, I knw yhu can cure her by the grace of Allah idan ka sa kanka, yhu neva can tell where one's reward Lie's"" wani matsiyacin kallo El-Ameen ke yi masa kafin ya mike yace ""Gaskiya ka janyo ma kanka fitina ka ja mana muma da muke tare da kai Ahmad, dama ban da abun ka me ya kai ka kama mahaukaciya kai da kake tuki a mota, Ohh My God!",health,Visiting a psychiatrist,public_interest,,safe,false,
hausa,latin,Nigeria,Kano,web_public,https://twitter.com/YusufSyd/status/2015916655348416832,2026-01-26,"*Allah baka nasara yanzu idan zaka rangadi kaine ke zaben hotel da zaka kwana koko gwamnati ke xabar maka? Sai yace ""Ni bani bukatar saina sauka a hotel don idan tani ne idan nazo gari ina iya rokon shago ko garka (zaure) in kwana, idan gari ya waye inyi wanka in fito babu mai g",livelihoods_and_work,Hotel accommodation,public_interest,,safe,true
Hausa,latin,Nigeria,Standard,web_public,https://www.rumbunilimi.com.ng/,2026-03-04,Muhammadu Buhari,governance_civic,personal name,public_interest,,safe,FALSE,
Hausa,latin,Nigeria,Sokoto,web_public,https://www.rumbunilimi.com.ng/,2026-03-04,"Salsalarsa Sir Ahmadu Bello Sardaunan Sokoto ɗan ƙabilar Fulani ne, kuma shi jika ne a wajen Shehu Mujadaddadi",culture_and_religion,Shehu Mujadaddadi and Sardauna of Sokoto,public_interest,,safe,FALSE,
Hausa,latin,Nigeria,Standard,web_public,https://gidandabino.blogspot.com/,2026-03-04,"In muka dawo kuma batun irin gudummawar da narubuta suke bukata za mu ga cewa batun samun tallafi daga gwamnati da hukumomi ne ya baibaiye wannan faifai na bayyana ra’ayi ko kididdiga sai kuma batun samun jagoranci yake biye masa sannan batun dillanci da dab’I ya zo na uku, sai abu na hudu batun kudI, wato taimako ko aro ko jari",media_and_online,Challenges faced by Hausa writers,public_interest,,safe,false,
Hausa,latin,Nigeria,Kano,web_public,https://www.rumbunilimi.com.ng/,2026-03-04,"Masarautar Kano Ƙofofin Kano Ƙofar Kudu Kansakali Waika Dawanau Lunkui/Ruwa Mazugal Wambai Hanga Gyarta-Wasa Kawaye Kawankari Barbushe Kadaɓa Shinkafa Ɓulɓula Mata Ɗan'agundi Nassarawa Na'isa Gadon Ƙaya Dukawuya Kabuga Famfo Alasan Rumfa Kasuwanni Kurmi Kantin Kwari Dawanau Wafa Ujile Wambai Sabon Gari Galadima 'Yankaba Rimi Ƙofar Ruwa Bachirawa Sarakunan Haɓe Barbushe Bagauda Warisi Gijimasu Nawata da Gawata Yusa Naguji Guguwa Shekarau Tsamiya Usmanu Ali Yaji Bugayya Kanajeji Umaru Dawuda Barja Dakauta Atuma Yakubu Rumfa Abdullahi Kisoke Yakufu Abasama Kaɗo Shahiri Zaki Nazaki Kutumbi Alhaji Shekarau Kukuna Soyaƙi Kukuna Bawa Daɗi Sherif Kumbari Kabi Yaji Zaki Dawuda Alwali Kundin Tsarin Mulkin Masarauta Bukukuwa Hawan Idi Hawan Daushe Hawan Nassarawa Hawan Ɗorayi Hawan Fanisau Wasu Gurare Gidan Ɗanhausa Gidan Nassarawa Tashoshin Mota Mariri Yaƙuƙuwa Yaƙin Turawa Latsa madannin ""Like"" ka nuna goyon baya ko kuma ""Share"" ka yaɗa shafin",culture_and_religion,Places and locations in Kano,public_interest,,safe,FALSE,
Hausa,latin,Nigeria,Kano,web_public,https://gidanlabarai.blogspot.com/,2026-03-06,"Har yamma Humainah bata koma part din Junaid ba shi ma kuma bai fito ba duk da xaman part din nasa ya ishesa, Zahrah kam na bangaren Hajja dake ta jan ta jiki kamar ta maida ta ciki, su khadija sai kallon ikon Allah suke, ko ta kan Ummi bata wani bi sai Zahrah",household_and_care,Family and relationships,public_interest,,safe,false,
Hausa,latin,Nigeria,Standard,web_public,https://fasahar-intanet.blogspot.com/,2026-02-19,Cikin taimakon Allah kuma an samu gamawa,culture_and_religion,divine assistance,public_interest,,safe,false,
Hausa,latin,Nigeria,Standard,web_public,https://www.rumbunilimi.com.ng/,2026-03-04,"Ƙauye, gari ne ƙarami, wanda hauloli da yawa suke samarwa, a mafiya yawan lokuta akan taras da cewa kusan dukkan irin waɗannan ƙauyuka ana samu sun haɗu da junansu ta fannin dangataka a nesa ko a kusa",culture_and_religion,rural villages and towns,public_interest,,safe,FALSE,
Hausa,latin,Nigeria,Standard,web_public,https://fasahar-intanet.blogspot.com/,2026-02-19,Sai mu kiyaye,culture_and_religion,preservation,public_interest,,safe,false,
Hausa,latin,Nigeria,Standard,web_public,https://fasahar-intanet.blogspot.com/,2026-02-19,"Dukkan wannan adadi, tsakure ne cikin daruruwan shafuka da zaurukan da matasanmu suka buɗe kuma suke aiwatar da sadarwa a tsakaninsu a wannan Dandali",media_and_online,online communication platforms,public_interest,,safe,false,
Hausa,latin,Nigeria,Standard,web_public,https://fasahar-intanet.blogspot.com/,2026-02-19,"Kowa ba ya iya karba daga wani, sai tsakanin layukansa",culture_and_religion,interpersonal relationships,public_interest,,safe,false,
Hausa,latin,Nigeria,Standard,web_public,https://www.rumbunilimi.com.ng/,2026-03-04,"Kakakin majalisar Dokokin Najeriya, honarabul Yakubu Dogara shi ya faɗawa ‘yan jarida haka (Umar, 2015; Ahovi da Abu, 2015)",governance_civic,Hausa parliamentary speaker,public_interest,,safe,FALSE,
Hausa,latin,Nigeria,Standard,web_public,https://www.rumbunilimi.com.ng/,2026-03-04,"Legas tana ƙarƙashin gwamna, Yankin Kudu kuma da Yankin Arewa suna ƙarƙashin babban kwamishina (hig commissioner) kowane ɗaya",governance_civic,Administrative divisions,public_interest,,safe,FALSE,
Hausa,latin,Nigeria,Standard,web_public,https://fasahar-intanet.blogspot.com/,2026-02-19,Bayan wasu 'yan lokuta ba a gano wanda yayi wannan ta'asa ba,governance_civic,unidentified person's action,public_interest,,safe,false,
Hausa,latin,Nigeria,Standard,web_public,www.bbc.com/hausa,2026-02-19,Ina matukar damuwa dangane da yadda ake ƙyamar masu sanya hijabi,culture_and_religion,Hijab discrimination,stereotypes,religion,sensitive,false,
Hausa,latin,Nigeria,Kano,web_public,https://gidanlabarai.blogspot.com/,2026-03-06,"Kai ni gun Granny din Ahmad Junaid"" kallonta El-ameen ya tsaya yi, can ya lumshe ido yace ""Ohk, Alryt"" daga haka ya fadi ma me taxin inda xai kai su, Aliyu yace ""Bari in sauka nan, kar ya rainani idan ya sake ganina gidansu"" murmushi kawai El-ameen yayi yasa mai taxin yayi parking Aliyu ya sauka, El-ameen yace ""Thanks frnd sai mun yi waya"" d'aga ma Zahrah da Ummi hannu Aliyu yayi ya bar wajen",livelihoods_and_work,conversation between friends,public_interest,,safe,false,
Hausa,latin,Nigeria,Standard,web_public,https://munbarin-musulunci.blogspot.com/,2026-03-04,Me zakace ko kuma ka tambaya,livelihoods_and_work,query or request,public_interest,,safe,false,
Hausa,latin,Nigeria,Standard,web_public,www.bbc.com/hausa,2026-02-19,"Kuma wannan ya ci gaba, bayan sun ƙaura zuwa Minnesota, lokacin da Halima ke 'yar shekara bakwai, ta zama wani ɓangare na mafi yawan al'ummar Somaliya a Amurka",culture_and_religion,Migration to Minnesota,public_interest,ethnicity,safe,false,
Hausa,latin,Nigeria,Kano,web_public,https://gidanlabarai.blogspot.com/,2026-03-06,"Ko da ya fito daga dakin masallaci ya fita yin sllhn Azahar, yana dawowa ya sameta har lokacin tana bacci, kujerar ya shiga bugawa a hankali ta bude ido da sauri ya koma baya yace ""Amm tashi kiyi sllh"" gyara xaman ta tayi tana masa wani kallo tace ""You kept me waiting"" yace ""Sorry plss"" mikewa tayi ya nuna mata daki yace ""Akwai toilet a ciki"" bata ce komai ba ta shiga bedroom din, ba a dau lokaci ba ta fito yace ""me yasa baki ci abincin fa?"" Girgixa kai tayi tace ""Abincin gidanmu kawai nake ci"" xaro ido yayi yana kallonta, sosai ta basa dariya sai dai ya dake bai yi ba, kallon jikinta tayi tace ""But",household_and_care,Daily activities,public_interest,,safe,false,
Hausa,latin,Nigeria,Standard,web_public,www.bbc.com/hausa,2026-02-19,"Isa Ali Pantami: Ministan sadarwa ya zaftare farashin Data a NajeriyaKatin ɗan ƙasa: Abin da ya sa Pantami ya dakatar da wasu ma'aikatan NIMCTa yaya mutum zai sauke manhajar NIMC a wayar?A farko dai, za ku iya sauke manhajar daga Google Play Store idan kuna amfani da waya ƙirar Android, haka kuma ga masu amfani da iPhone za su iya zuwa Apple Store domin duba manhajar domin su sauke",governance_civic,Data pricing in Nigeria,public_interest,,safe,false,
Hausa,latin,Nigeria,Unknown,web_public,https://www.rumbunilimi.com.ng/,2026-03-04,Hargreaves J,education,name,public_interest,,safe,FALSE,
Hausa,latin,Nigeria,Standard,web_public,https://fasahar-intanet.blogspot.com/,2026-02-19,"Wannan shi ake kira Searching, a turancin fasahar sadarwa",media_and_online,information technology,public_interest,,safe,false,
Hausa,latin,Nigeria,Sokoto,web_public,https://www.rumbunilimi.com.ng/,2026-03-04,"Shehu yana tsaka da wannan kira sai umarnin kora daga ƙasar Gobir ya zo masa daga Sarkin Gobir Yunfa, abin da ya sabauta masa yin hijira zuwa ga ƙungurmin dajin Gudu",culture_and_religion,Migration to Gudu forest,public_interest,,safe,FALSE,
Hausa,latin,Nigeria,Standard,web_public,https://fasahar-intanet.blogspot.com/,2026-02-19,"A wannan shekara ne aka tabbatar da cewa akwai a kalla kayayyakin fasahar sadarwa masu dauke da wannan fasaha ta Bluetooth sama da miliyan 250, kuma a duk mako a kalla akan fitar da sababbin kayayyakin fasahar sadarwa dauke da Bluetooth, sama da miliyan uku",livelihoods_and_work,Bluetooth technology adoption,public_interest,,safe,false,
Hausa,latin,Nigeria,Standard,web_public,https://www.rumbunilimi.com.ng/,2026-03-04,Rasuwarta Nana Asma'u ta rasu a shekarar 1864,culture_and_religion,Death of Nana Asma'u,public_interest,,safe,FALSE,
Hausa,latin,Nigeria,Standard,web_public,https://fasahar-intanet.blogspot.com/,2026-02-19,"Idan shafukan da ka shiga akwai hotona da bidiyo, to, za a cire kudi mai dimbin yawa",media_and_online,online content monetization,public_interest,,safe,false,
Hausa,latin,Nigeria,Standard,web_public,https://www.rumbunilimi.com.ng/,2026-03-04,"Yakan yi amfani da siga ta girmamawa da kwantar da kai gaba ga malamansa a yayin karatu da kuma neman ƙarin haske wanda hakan ta sa, a nasu ɓangaren su malaman suka zamo suna maraba da shi a duk lokacin da yake da buƙata",education,student and teacher,public_interest,,safe,FALSE,
Hausa,latin,Nigeria,Kano,web_public,https://www.rumbunilimi.com.ng/,2026-03-04,") Ado Bayero ya yi aikin banki tare da ‘The Bank of British West Africa’ har zuwa shekarar 1949, inda daga nan kuma ya zarce zuwa hukumar nan ta ‘Native Authority’ wacce ake yiwa laƙabi da (NA) a matsayin akawun majalisa",livelihoods_and_work,Ado Bayero's banking career,public_interest,,safe,FALSE,
Hausa,latin,Nigeria,Standard,web_public,www.bbc.com/hausa,2026-02-19,"Sai ta kada baki ta ce: ""Kwarai kuwa, za mu yi aiki da doka",livelihoods_and_work,work and rules,public_interest,,safe,false,
Hausa,latin,Nigeria,Standard,web_public,www.bbc.com/hausa,2026-02-19,"(AS)Ighalo zai tafi Amurka, Neymar da PSG na tattaunawa kan kwantiragiPochettino ya lashe kofi a karon farko a tarihinsa Hakan na nufin watakila Barcelona ta jinkirta har sai kwangilar Garcia ta kare a bazara kafin ta dauke shi, yayin da kuma kungiyar ba za ta iya biyan kudin dauko tsohon dan wasan makarantar horas da 'yan kwallon nata ba a watan nan na Janairu",livelihoods_and_work,Football player transfer news,public_interest,,safe,false,
Hausa,latin,Nigeria,,web_public,https://gidanlabarai.blogspot.com/,2026-03-06,""" Ta marairaice tace ""Are we going?"" Wani mugun kallo yake mata xai yi magana El-ameen ya fito, kamar xata yi kuka tace ""Uncle wai tafiya xa mu yi"" El-ameen yace ""A'a mu je ki ci abincin ki"" juyawa tayi ta koma parlon, El-ameen ya d'aga ma junaid hannu yana murmushi yace ""In xaka shigo ka shigo malam"" daga haka ya koma parlon, xaunawa Junaid yayi ya dafe kansa, can ya mike ya sauka daga balcony din ya nufi motarsa ya shiga ya danna horn mai gadi ya bude masa gate ya fice daga gidan, Jasmine tace ""Uncle ya tafi"" El-ameen yace ""Ci abincin ki"" a hankali tace ""Toh"" ta ci gaba da cin abincin ta, yana nan xaune har ta gama ta mike tace ""Na gama uncle ka tafi da ni gida"" shiru yayi yana kallonta, ta koma ta xauna ta marairaice tace ""Ka ji?"" Yace ""Nan ba gida bane?"" Bin parlon tayi da kallo a hankali tace ""Gidan Captain xaka kai ni"" hade rai yayi yace ""ina aiki a sama sai na gama"" daga haka ya haura sama ya bar ta wajen, mikewa tayi ta bi sa da kallo kamar xata yi kuka, ko minti biyar ba ayi da tafiyarsa sama ba, Hafsat ta sauko tace ""Har kin gama"" gyada mata kai tayi, Hafsat tace ""Toh taho mu je sama"" ba musu Jasmine ta nufi stairs suka haura sama a tare Hafsat ta shiga da ita dakinta ta nuna mata gado ta xauna, sannan ta kunna mata kallo",,,,,safe,false,
Hausa,latin,Nigeria,Kano,web_public,https://gidanlabarai.blogspot.com/,2026-03-06,"Junaid na kwance parlor da yamma b4 magrib yana danne dannen waya, khadija ta shigo parlorn, Karasowa tayi ta xauna gefensa tace ""Ina yini ya A'jay?"" Yace ""Lfya lau, kar ma ki fara tambayata kudi don bani da"" dariya tayi tace ""Kai yayana"" sai kuma ta d'an yi shiru, a hankali tace ""Kasan me yaya, karka ci abincin gidan nan yau, just go out and get somethin to eat ae kasan yanxu an daina girki daban daban koh"" yana kallonta yace ""Why!"" Ta daga kafada tace ""Just, beside ma porridge ne kuma ae bama ka ci"" mikewa tayi tace ina xuwa, ta fice daga parlon, ya bi ta da kallo yana murmushi",household_and_care,social interaction,public_interest,,safe,false,
hausa,latin,Nigeria,Standard,web_public,https://twitter.com/ADPRMR/status/2016626734888550687,2026-01-28,[USER] MashaAllah Allah ya kara karfin gwiwa wajan Yuma alumma aiki,culture_and_religion,Appreciation and encouragement,public_interest,,safe,true
Hausa,latin,Nigeria,Standard,web_public,https://www.rumbunilimi.com.ng/,2026-03-04,"Sunan an samo shi daga Ruma, wani jikan Annabi Ibrahim wanda mutane biyu ne tsakaninsa da Annabi Ibrahim kamar haka; Ruma ɗan Isi ɗan Ishaƙa ɗan Ibrahim",culture_and_religion,Lineage of Prophet Ibrahim,public_interest,,safe,FALSE,
Hausa,latin,Nigeria,Standard,web_public,https://fasahar-intanet.blogspot.com/,2026-02-19,Prince Babani Yola,culture_and_religion,Prince Babani Yola,public_interest,,safe,false,
Hausa,latin,Nigeria,Standard,web_public,https://fasahar-intanet.blogspot.com/,2026-02-19,""" Sai bayani mai taken: ""Tallafin Hasken Laser ga Fannin Likitanci",health,Laser technology in medicine,public_interest,,safe,false,
Hausa,latin,Nigeria,Standard,web_public,https://fasahar-intanet.blogspot.com/,2026-02-19,"Wannan duniya dai Jama'a, ita ce duniyar gamewar mu'amala a mahallin sadarwa",culture_and_religion,social interaction,public_interest,,safe,false,
Hausa,latin,Nigeria,Standard,web_public,www.bbc.com/hausa,2026-02-19,"Me ya sa ake son tsige Trump a yanzu ?Abin da ya faru a majalisar dokokin Amurka ranar 6 ga watan Janairun 2021, abu ne da tarihi ba zai taɓa mantawa da shi ba",governance_civic,Trump's popularity in Nigeria,public_interest,,safe,false,
Hausa,latin,Nigeria,Standard,web_public,https://www.rumbunilimi.com.ng/,2026-03-04,"Mutum ne basarake, mashahurin malami masanin tarihi da kimiyyar siyasa, dandaƙaƙƙen marubuci, ɗan kishin ƙasa, mai fafutikar ‘yanci, haziƙi kuma fasihi, sannan kuma maras tsoro",education,Prominent Hausa scholar,public_interest,,safe,FALSE,
Hausa,latin,Nigeria,Standard,web_public,www.bbc.com/hausa,2026-02-19,Hukumar samar da hasken wutar lantarki a Najeriya ta nemi kafofin watsa labarai a ƙasar cewa su janye rahotannin da suka buga cewa hukumar ta yi ƙarin kudin wuta da kashi hamsin cikin dari,governance_civic,Electricity supply in Nigeria,public_interest,,safe,false,
Hausa,latin,Nigeria,Standard,web_public,https://fasahar-intanet.blogspot.com/,2026-02-19,"A taƙaice dai, tsarin 'yan uwantaka ya daɗa ƙulluwa a tsakanin matasa",culture_and_religion,relationships between youth,stereotypes,,safe,false,
Hausa,latin,Nigeria,Standard,web_public,www.bbc.com/hausa,2026-02-19,To sai dai kasancewar mutum Sarki a birnin Paris na Faransa da ke nahiyar Turai na samuwa ne ta hanyar kada kuri'a wato irin wadda ake kadawa a lokacin zabuka,governance_civic,Election voting in Paris,public_interest,,safe,false,
Hausa,latin,Nigeria,Standard,web_public,https://kimiyyah.blogspot.com/,2026-03-04,Wadannan su ne shahararrun marhaloli hudu masu muhimmanci da wannan fannin ilimi ya kutso ta cikinsu,education,important Hausa academic fields,public_interest,,safe,false,
Hausa,latin,Nigeria,Standard,web_public,https://www.rumbunilimi.com.ng/,2026-03-04,"Akwai unguwanni da suke zagaye da ita kamar irin su Jakara, Bakin Zuwo, Kwanar Goda, Ƙofar Wambai, da sauransu",culture_and_religion,neighborhoods,public_interest,,safe,FALSE,
Hausa,latin,Nigeria,Standard,web_public,https://fasahar-intanet.blogspot.com/,2026-02-19,"A kasidar farko mun kawo misalai ne kan haka, dangane da rayuwar matasan kasar Hausa a wannan Dandali",culture_and_religion,Hausa youth life,public_interest,,safe,false,
Hausa,latin,Nigeria,Standard,web_public,https://fasahar-intanet.blogspot.com/,2026-02-19,Sannan dukkan Malamai sun yarda cewa ba a amfani da mafarki wajen tabbatar da shari'a sai idan abin da mafarkin ya kunsa yayi daidai da shari'a tabbatacciya,culture_and_religion,Shari'a law and dreams,public_interest,,safe,false,
Hausa,latin,Nigeria,Standard,web_public,www.bbc.com/hausa,2026-02-19,"Yadda yaran da aka haifa a manne da juna ke rayuwa a makarantaMace ta farko gwanar zamiyar kan ruwa a SenegalBabban LabariYadda budurwa ta cinna wa saurayinta wuta a BenueMintuna 42 da suka wuceYadda kafofin watsa labarai suka yi 'kuskure' kan sace-sacen ɗalibai a NajeriyaSa'o'i 7 da suka wuceKAI TSAYE An kama wanda ya yi wa yaro fyaɗe ya kashe shi a MorokoMinti Daya Da BBC1:00Saurari, MINTI ƊAYA DA BBC - LABARAN RANA - 13/01/2021, Tsawon lokaci 1,00MINTI ƊAYA DA BBC - LABARAN RANA - 13/01/202113 Janairu 2021Wanda aka fi karantawa1Yadda budurwa ta cinna wa saurayinta wuta a Benue2An ya Neymar zai so ya sake komawa Barcelona kuwa?3Matashin da ƙunci ya sa ya cinna wa kansa wuta a Kuwait4Yadda za ku duba sakamakon jarrabawar NECO a shafin intanet5Yadda kafofin watsa labarai suka yi 'kuskure' kan sace-sacen ɗalibai a Najeriya",media_and_online,News and current events,public_interest,,safe,false,
Hausa,latin,Nigeria,Standard,web_public,www.bbc.com/hausa,2026-02-19,Wani dalilin kuma shi ne ba su so a samu wani shugaba na karamar hukuma da zai kalubalance su,governance_civic,local government leadership,public_interest,,safe,false,
Hausa,latin,Nigeria,Standard,web_public,www.bbc.com/hausa,2026-02-19,"""Ta yaya annobar ta shafi tattalin arziki?A cewar Dr",livelihoods_and_work,economic impact,public_interest,,safe,false,
Hausa,latin,Nigeria,Standard,web_public,https://www.rumbunilimi.com.ng/,2026-03-04,"An gudanar da taron a garin Tunis, na ƙasar Tunisiya",culture_and_religion,Hausa conference in Tunisia,public_interest,,safe,FALSE,
Hausa,latin,Nigeria,Standard,web_public,https://gidandabino.blogspot.com/,2026-03-04,"Ina son na ga ana yi mana gyara, ana kula da abin da muke yi, saboda ita rayuwa in har ba ka da mafadi, to, ba za ka ga da kyau ba, ina jin ciwon yadda manyan marubuta irin ku kuka bar mu kara zube babu mai sa mu ko hana mu, muna bukatar tallafin ku don bunkasa harkar",livelihoods_and_work,request for assistance,public_interest,,safe,false,
Hausa,latin,Nigeria,Standard,web_public,www.bbc.com/hausa,2026-02-19,"Kisan kaiA baya-bayan nan, Hamd ya shaida wa mahaifiyarsa cewa yana son ya gina rayuwa, yana son ya yi aure",culture_and_religion,Hausa family and marriage,public_interest,,safe,false,
Hausa,latin,Nigeria,Standard,web_public,https://kimiyyah.blogspot.com/,2026-03-04,"Fahimta kuwa, a cewarsu, ba ta samuwa sai ta hanyar tunani",education,understanding through thinking,public_interest,,safe,false,
Hausa,latin,Nigeria,Standard,web_public,https://www.rumbunilimi.com.ng/,2026-03-04,"Takarkarun da ya yi Janaral Muhammadu Buhari ya tsaya takarar neman ɗarewa kujerar shugabancin Najeriya a karo na biyu a matsayin farar hula har sau huɗu, sai a karo na huɗu ne aka dace",governance_civic,Buhari's presidential campaign,public_interest,,safe,FALSE,
3324c2c6-e527-49fd-9a3c-f1a971cb3357,hausa,latin,Nigeria,standard_hausa,media,https://www.bbc.com/hausa/articles/cwy884zd9nxo,2026-01-25T09:07:35.536Z,"A lardin Yunnan, ana sayar da tsiron L.",media_and_online,news_reporting,public_interest,,safe,true,,Collected from BBC Hausa
Hausa,latin,Nigeria,Standard,web_public,https://munbarin-musulunci.blogspot.com/,2026-03-04,Wannan ladan bawai ya takaitu a iya inda masallacin yake a lokacin ma'aikin Allah (Tsira da amincin Allah su tabbata a gareshi) kawai bane ya shafi har fadadashin da aka yi ne,culture_and_religion,mosque location and activity,public_interest,,safe,false,
Hausa,latin,Nigeria,Standard,web_public,www.bbc.com/hausa,2026-02-19,Amma akwai lokacin da Amurka za ta sake tunani a kan rawar da za ta iya takawa a duniya da kuma Gabas ta Tsakiya,governance_civic,US role in Middle East,public_interest,,safe,false,
Hausa,latin,Nigeria,Standard,web_public,www.bbc.com/hausa,2026-02-19,"Shugaban ma'aikata na Mista Biden Ron Klain ya ce da zarar an rantsar da Biden, zai mayar da Amurka cikin yarjejeniyar sauyin yanayi, sannan ya soke haramcin shiga kasar daga wasu kasashen musulmai da shugaba Trump ya sanya",governance_civic,Hausa politics and policy,public_interest,,safe,false,
Hausa,latin,Nigeria,Standard,web_public,www.bbc.com/hausa,2026-02-19,"Mista Assenge ya ƙalubalanci tasa ƙeyar tasa, yana mai cewa maƙarƙashiya ce irinta siyasa",governance_civic,Politics and policy,stereotypes,other,sensitive,false,
Hausa,latin,Nigeria,Standard,web_public,www.bbc.com/hausa,2026-02-19,Sojojin Nijar na cikin sojojin ƙawancen ƙasashen tafkin Chadi da ke yaki da ISWAP da Boko Haram a yankin tafkin Chadi,governance_civic,Nigerien soldiers in Chad,public_interest,,safe,false,
Hausa,latin,Nigeria,Standard,web_public,https://www.rumbunilimi.com.ng/,2026-03-04,"Kafuwarta Kafuwar garin Kaduna ya sha bambam da abin da aka saba na kafuwar garuruwa, wannan gari tun farkonsa alƙarya ce",culture_and_religion,Kaduna city description,public_interest,,safe,FALSE,
Hausa,latin,Nigeria,Kano,web_public,https://gidanlabarai.blogspot.com/,2026-03-06,""" Da sauri Junaid yace ""Xuwa kayi ka samesa?"" Faisal ya d'aga masa gira, Junaid yace ""Ohhh shit!",household_and_care,Informal conversation,stereotypes,ethnicity,sensitive,false,
Hausa,latin,Nigeria,Standard,web_public,https://fasahar-intanet.blogspot.com/,2026-02-19,"Kowace wayar salula na iya baka damar taskancewa (ta hanyar rubutu), da kuma adanawa (ta hanyar masarrafai) ga duk abin da kake ganin sirri ne a gare ka",media_and_online,communication methods,public_interest,,safe,false,
Hausa,latin,Nigeria,Standard,web_public,https://www.rumbunilimi.com.ng/,2026-03-04,Laftanar Kanal (Lieutenant Colonel) 1974,livelihoods_and_work,Military rank,specialized_advice,,safe,FALSE,
Hausa,latin,Nigeria,Standard,web_public,https://fasahar-intanet.blogspot.com/,2026-02-19,"Sai abu na karshe da nake son dakatawa a kai, watau saukin rayuwa",culture_and_religion,simple living,public_interest,,safe,false,
Hausa,latin,Nigeria,Standard,web_public,https://fasahar-intanet.blogspot.com/,2026-02-19,Wannan ke dada nuna mana irin karbuwa da kuma habbaka da wannan fasahar sadarwa ke samu kuma take yi a duniya,media_and_online,communication technology,public_interest,,safe,false,
Hausa,latin,Nigeria,Standard,web_public,https://fasahar-intanet.blogspot.com/,2026-02-19,Abu na farko shi ne aljihunka,household_and_care,possessions and belongings,public_interest,,safe,false,
Hausa,latin,Nigeria,Standard,web_public,www.bbc.com/hausa,2026-02-19,"A ganinsu, dukkan abin da ya kamata a tunasar da shugaban ƙasa a kansa, an faɗa a wannan waƙar",culture_and_religion,Poetic content,public_interest,,safe,false,
Hausa,latin,Nigeria,Standard,web_public,https://www.rumbunilimi.com.ng/,2026-03-04,"Wannan jaha, ta fara aiki a ranar 1 ga watan Afirilu na shekarar 1968",livelihoods_and_work,Work start date,public_interest,,safe,FALSE,
Hausa,latin,Nigeria,Kano,web_public,https://www.rumbunilimi.com.ng/,2026-03-04,"Tarihin Kano Kafin Jihadi, Wangarawa sun iso Kano, Littafi na Biyu",culture_and_religion,History of Kano before Jihad,public_interest,,safe,FALSE,
