language,script,country,region_dialect,source_type,source_ref,collection_date,text,domain,topic,theme,sensitive_characteristic,safety_flag,pii_removed,collector_id
Hausa,latin,Nigeria,Standard,web_public,www.bbc.com/hausa,2026-02-19,"Mai magana da yawun ma'aikatar ya ce an kwantar da mutum 456 a asibiti a ƙasar daga cikin 5,924 da suka kamu da cutar",health,Health and medical treatment,public_interest,,safe,false,
Hausa,latin,Nigeria,Standard,web_public,www.bbc.com/hausa,2026-02-19,"""Za mu yi ƙoƙarin koyar da iyayen yara yaƙi da jahilci ta yadda ba za su yi wasa wajen tura `ya`yansu makaranta ba,"" in ji shi",education,education and parenting,public_interest,,safe,false,
Hausa,latin,Nigeria,Kano,web_public,https://www.rumbunilimi.com.ng/,2026-03-04,"Tabbas, wannan shi ne Alhaji Yusuf Maitama Sule, Ɗanmasanin Kano",culture_and_religion,Alhaji Yusuf Maitama Sule,public_interest,,safe,FALSE,
hausa,latin,Nigeria,Kano,web_public,https://twitter.com/IluAhmad_/status/2016588190916681919,2026-01-28,[USER] Malam Siyasar Kano cike take fal da Kananun Mutane,governance_civic,Kano politics,public_interest,,safe,true
Hausa,latin,Nigeria,Standard,web_public,https://www.rumbunilimi.com.ng/,2026-03-04,"Bayan da wannan buƙata ta samu karɓuwa, sai aka faɗaɗa ta ta hanyar baiwa wasu ƙasashen damar bin wannan tafarkin",governance_civic,public policy,public_interest,,safe,FALSE,
Hausa,latin,Nigeria,Standard,web_public,https://www.rumbunilimi.com.ng/,2026-03-04,Saboda haka sai mutane suka riƙa kwatanta gurin da garin Zindir; wato garin mutanen da suke yawo zindir ba tare da suturar da ta rufe dukkan jikinsu ba kamar yadda wakilin tarihin Masarautar Damagaran ya shaida mana a cikin tattaunawar mu da shi,culture_and_religion,Garin Zindir description,stereotypes,,safe,FALSE,
Hausa,latin,Nigeria,Standard,web_public,https://www.rumbunilimi.com.ng/,2026-03-04,"Onawo (2016), ya ƙara da Goemi, Migili, Etulu, Iyala da Aros",culture_and_religion,Geographical locations,public_interest,,safe,FALSE,
Hausa,latin,Nigeria,Standard,web_public,https://munbarin-musulunci.blogspot.com/,2026-03-04,to wannan malamai masana Sira da Tarihi sun karawa juna sani akan haka,education,knowledge sharing among scholars,public_interest,,safe,false,
Hausa,latin,Nigeria,Standard,web_public,https://munbarin-musulunci.blogspot.com/,2026-03-04,"Mai Juna-biyu (Mai ciki): Galibin mata masu juna biyu basa al'ada, sabo da haka da zarar mace tana da juna biyu (ciki) sai kuma ta ga al'ada to kada ta yi sakaci wurin tuntubar likita",health,Pregnancy and menstruation,specialized_advice,,safe,false,
Hausa,latin,Nigeria,Standard,web_public,https://kimiyyah.blogspot.com/,2026-03-04,"Rashin bacci kan taimaka wajen yawan zuban sinadaran insulin a jikin dan adam, wanda hakan ke taimakawa wajen haddasa yawan kiba a jiki Rashin bacci na haddasa yawan mantuwa, domin kwakwalwa kan samu kanta ne cikin halin rudu",health,Insulin and sleep,public_interest,,safe,false,
Hausa,latin,Nigeria,Standard,web_public,www.bbc.com/hausa,2026-02-19,Ya rasu ne a ranar Asabar kamar yadda gwamnatin jihar Borno ta sanar,culture_and_religion,Death announcement,public_interest,,safe,false,
Hausa,latin,Nigeria,Standard,web_public,https://www.rumbunilimi.com.ng/,2026-03-04,Ya rayu tsawon shekaru 69 a duniya,health,longevity,public_interest,age,safe,FALSE,
Hausa,latin,Nigeria,Standard,web_public,www.bbc.com/hausa,2026-02-19,"Asalin hoton, Al-Majlis TVBayanan hoto, Dan majalisa al-Khalifah ya yi kira ga gwamnati ta diba batun ƴan BidoonMai rajin kare haƙƙin Bidoon Abdullah al-Rabah ya ce yana son ganin an ba ƴan Bidoon 34,000 ƴancinsu na zama ƴan ƙsa kuma sauran a ba su ƴancinsu, wanda zai ba su damar yin rayuwarsu",governance_civic,Bidoon citizenship rights,public_interest,nationality,sensitive,false,
hausa,latin,Nigeria,Standard,web_public,https://twitter.com/PTimesHausa/status/2016656388701708683,2026-01-28,WHO ta yi kira ga kasashen duniya da su inganta cin abincin dake gina garkuwar jikin yara a makarantu [URL],health,Nutrition and child health,public_interest,,safe,true
Hausa,latin,Nigeria,Standard,web_public,www.bbc.com/hausa,2026-02-19,"Asalin hoton, Getty ImagesBayanan hoto, An ce a birnin Aksum ne Bilkisu Sarauniya Saba matar Annabi Sulaiman ta yi mulki2",culture_and_religion,Bilkisu Sarauniya Saba,public_interest,,safe,false,
Hausa,latin,Nigeria,Standard,web_public,https://www.rumbunilimi.com.ng/,2026-03-04,"1969 – 1973, ya riƙe muƙamin shugaban reshen Najeriya na Ƙungiyar Goyon Bayan ‘Yan Afirka a Yankin Asiya (Chairman Nigerian Chapter Afro-Asian People’s Solidarity Organization (AAPSO))",governance_civic,African political organization,public_interest,,safe,FALSE,
Hausa,latin,Nigeria,Standard,web_public,https://www.rumbunilimi.com.ng/,2026-03-04,"Kenan Idan muka yi wa wannan suna fassara ta kwatance sai mu ce, mutane masu kama da haske",culture_and_religion,description of people,stereotypes,,safe,FALSE,
Hausa,latin,Nigeria,Standard,web_public,https://www.rumbunilimi.com.ng/,2026-03-04,"daga cikin irin wannan unguwanni akwai Go-Ndoku, wacce ke nufin gidan sarki ko fadar sarki",culture_and_religion,royal residence,public_interest,,safe,FALSE,
Hausa,latin,Nigeria,Standard,web_public,https://www.rumbunilimi.com.ng/,2026-03-04,Kuma na yarje maka dukkan abubuwan da ka ke son aikatawa a waɗannan garuruwan namu”,livelihoods_and_work,Doing things in our places,public_interest,,safe,FALSE,
Hausa,latin,Nigeria,Standard,web_public,https://fasahar-intanet.blogspot.com/,2026-02-19,"Idan kana bukatar tunatarwa cikin dare, sai ka je cikin Menu, ka shiga manhajar agogo (Clock) ko manhajar tunatarwa/farkarwa (Alarm), ka shigar da lokacin da kake son a farkar da kai",household_and_care,Using technology for reminders,public_interest,,safe,false,
Hausa,latin,Nigeria,Standard,web_public,https://fasahar-intanet.blogspot.com/,2026-02-19,"Abin da wannan ke nunawa shi ne, baka shiga shafinka ta hanyar da ka saba shiga ba, kamar yadda nayi bayanai makamancin wannan a sama",media_and_online,Accessing online account,public_interest,,safe,false,
Hausa,latin,Nigeria,,web_public,https://www.rumbunilimi.com.ng/,2026-03-04,"Da bakinsa yake cewa, “Da mu muke yi, aka zo ana yi da mu, yanzu kuma sai an yi a gaya mana” (Mahmood, 2014)",,,,,safe,FALSE,
Hausa,latin,Nigeria,Standard,web_public,https://www.rumbunilimi.com.ng/,2026-03-04,An ciro daga: [URL],media_and_online,URL link,public_interest,,safe,TRUE,
Hausa,latin,Nigeria,Standard,web_public,https://fasahar-intanet.blogspot.com/,2026-02-19,Zuciya ba ta da kashi,culture_and_religion,heart's state,public_interest,,safe,false,
Hausa,latin,Nigeria,Standard,web_public,www.bbc.com/hausa,2026-02-19,Magoya bayan Trump sun tayar da rikici a Majalisar Dokokin AmurkaHotunan yadda magoya bayan Donald Trump suka kutsa majalisar AmurkaMajalisar Amurka ta ci gaba da zama bayan harin magoya bayan TrumpDakarun Birtaniya sun yi ƙoƙarin kone shi ƙurmus - shekarar 1814Watakila za a iya cewa shi ne harin da ya fi ƙaurin suna wanda dakarun Birtaniya suka kai a lokacin yaƙin shekarar 1812,governance_civic,Trump supporters' unrest,public_interest,,sensitive,false,
Hausa,latin,Nigeria,Standard,web_public,https://kimiyyah.blogspot.com/,2026-03-04,"Daga cikin wadanda suka yi wannan namijin kokari akwai Taajul Lugha, Muhammad ibn Qaasim, wanda aka fi sani da ""Al-Ambaari"", cikin littafinsa mai suna: ""Al-Adhdhaadu Fil-Lugha,"" da kuma babban Malamin Lugha, watau ""Al-Jarjaanee"", cikin littafinsa mai suna: ""At-Ta'areefaat",education,Hausa language scholars,specialized_advice,,safe,false,
Hausa,latin,Nigeria,Unknown,web_public,https://www.rumbunilimi.com.ng/,2026-03-04,com/general-ty-danjuma/ Wikipedia (2016),media_and_online,Wikipedia article,public_interest,,safe,FALSE,
Hausa,latin,Nigeria,Standard,web_public,www.bbc.com/hausa,2026-02-19,Rashin kofofi da tagogi dai ya sa yara na shiga ajjujuwan suna yin kwallon kafa,livelihoods_and_work,youth soccer,public_interest,,safe,false,
Hausa,latin,Nigeria,Kano,web_public,https://gidanlabarai.blogspot.com/,2026-03-06,""" El-ameen yayi saurin cewa ""Ameen Umma mun gode"" Umma ta kalli Zahrah tace ""Kin kai su gun Kilishi?"" Ta gyada kai tace ""Can muka fara xuwa"" Umma tace ""To Maa sha Allah"" ba su wani dade part din Umma ba ta dalilin bakin da tayi, Zahrah ta nufi fada gun Abbanta da su, sai dai wannan karan sauri kawai take bata bari sun jera da El-ameen din ba, bai takurata ba ya jira junaid, junaid na isa gunsa yace ""ya kuma ku ka raba tafiyar?"" Murmushi yyi yace ""Yea hakan yafi don ni ba runguma bane iyakar abinda zan mata idan na kasa jure shariyarta gare ni"" Wani kallo Junaid ke yi masa kafin yace komai El-ameen yayi dariya yayi gaba ya bar sa nan, suna shiga fada ta juya ta bar su tare da Abbanta",culture_and_religion,Conversation between Umma and Zahrah,public_interest,,safe,false,
Hausa,latin,Nigeria,Standard,web_public,https://fasahar-intanet.blogspot.com/,2026-02-19,"A iya wannan tazara, idan ka kunna fasahar Bluetooth din ka, to duk wanda nasa ke kunne a iya kadadar wannan tazara ko zango, za ka same shi da zarar ka nemo, har kuma ka iya aika masa da sako",livelihoods_and_work,Bluetooth usage instructions,specialized_advice,,safe,false,
Hausa,latin,Nigeria,Standard,web_public,https://www.rumbunilimi.com.ng/,2026-03-04,A siyasance kuma ya riƙe ‘Chairman National Peace and Reconciliation Committee’ na jama’iyyarsa ta PDP,governance_civic,Political leadership,public_interest,,safe,FALSE,
Hausa,latin,Nigeria,Standard,web_public,www.bbc.com/hausa,2026-02-19,"Mutane da dama a wasu ƙasashen sun nuna mamaki da dokokin kullen amma cikin ƴan watanni, sai ga ƙasashen duniya na ƙaƙaba dokokin kullen",culture_and_religion,Reaction to cultural policies,public_interest,,safe,false,
Hausa,latin,Nigeria,Standard,web_public,https://munbarin-musulunci.blogspot.com/,2026-03-04,اَللهُ أَكْبَرُ – أَكْبَارُ,culture_and_religion,Islamic expression,public_interest,,safe,false,
Hausa,latin,Nigeria,Borno,web_public,www.bbc.com/hausa,2026-02-19,Ndume na cikin waɗanda ke yawan sukar yadda gwamnatin jam'iyyarsu ta APC ke tunkarar yaƙi da ƙungiyar Boko Haram a lokuta daban-daban a jiharsa ta Borno da yankin arewa maso gabas,governance_civic,Boko Haram conflict,public_interest,ethnicity,sensitive,false,
Hausa,latin,Nigeria,Unknown,web_public,https://www.rumbunilimi.com.ng/,2026-03-04,What are the educational ƙualifications of mark zuckerberg?,education,educational qualifications,public_interest,,safe,FALSE,
hausa,latin,Nigeria,Standard,web_public,https://twitter.com/faruck_aleeyu/status/2016649145918841284,2026-01-28,[USER] Masha Allah. Duk rintsi duk wuya kada ka bari mahaifinka ya zama na banza kun daiji Jamaa. The man did it because of his Dad inda mutinmin banza ne wlh bazaiyi ba. Allah kara daukaka ku damu baki daya. Ameen ya Rahman,culture_and_religion,Blessing and advice,public_interest,,safe,true
Hausa,latin,Nigeria,Standard,web_public,https://www.rumbunilimi.com.ng/,2026-03-04,Ogunbado (2003) ya ƙara da cewa sannan kuma akwai mutane sama da miliyan ɗaya da suke magana da wannan harshe a ƙasashe irin su Cuba da Birtaniya da sauran su,culture_and_religion,Hausa speakers worldwide,public_interest,,safe,FALSE,
Hausa,latin,Nigeria,Standard,web_public,https://munbarin-musulunci.blogspot.com/,2026-03-04,"Falalar Yin Layyah: Nana Aishah Allah ya kara mata yarda ta ruwaito cewa lallai Ma'aikin Allah tsira da amincin Allah su tabbata agareshi ya ce "" Dan'adam bai taba yin wani aiki aranar Babbar Sallah ba da yafi soyiwa a gurin Allah kamar zubar da jinni ba",culture_and_religion,Importance of Prayer,public_interest,,safe,false,
Hausa,latin,Nigeria,Unknown,web_public,https://munbarin-musulunci.blogspot.com/,2026-03-04,اَللَّهُمَّ بَارِكْ لَنَا فِي ثَمَرِنَا، وَبَارِكْ لَنَا فِي مَدِينَتِنَا، وَبَارِكْ لَنَا فِي صَاعِنَا، وَبَارِكْ لَنَا فِي مُدِّنَا)) مسلم,culture_and_religion,Islamic prayer,public_interest,religion,safe,false,
Hausa,latin,Nigeria,Standard,web_public,www.bbc.com/hausa,2026-02-19,"Asalin hoton, ReutersBayanan hoto, Rokar SpaceX da aka cillata don gwaji a farfajiyar kamfanin da ke Boca Chica, a Jihar Texas cikin Disamba",media_and_online,SpaceX rocket test,public_interest,,safe,false,
Hausa,latin,Nigeria,Standard,web_public,https://fasahar-intanet.blogspot.com/,2026-02-19,Wanda kuma idan ka duba za ka samu zuciya ta fi maimaituwa kuma an fi bayyana ta a fili karara,culture_and_religion,Emotional expression,public_interest,,safe,false,
Hausa,latin,Nigeria,Standard,web_public,https://fasahar-intanet.blogspot.com/,2026-02-19,"Haka idan 'yan uwa ne, musamman iyaye",culture_and_religion,family and relationships,public_interest,,safe,false,
Hausa,latin,Nigeria,Standard,web_public,https://munbarin-musulunci.blogspot.com/,2026-03-04,"Idan said a kuka sha ruwa, sannan sai kuma jiginku ya tashi, jirgin yana tashi sai kuma ga rana a sama, to anan malamai suka ce za ku ci gaba da cin abincin ku ne kawai babu wata matsala, domin tun farko kun ajiye azuminku a bisa ka’ida ta shari’a",culture_and_religion,Performing religious ablutions,public_interest,,safe,false,
Hausa,latin,Nigeria,Standard,web_public,https://fasahar-intanet.blogspot.com/,2026-02-19,"Da zarar sun isa masaukinsu a daya bangaren, akwai ka’idar da za ta gyatta su zuwa yanayinsu na asali",culture_and_religion,arrival at destination,public_interest,,safe,false,
Hausa,latin,Nigeria,Standard,web_public,https://www.rumbunilimi.com.ng/,2026-03-04,Wannan kalma ta ‘yan Najeriya ta tabbata a kansa saboda kasantuwarsa maras hannu a cikin badaƙalolin maƙudan kuɗaɗen da mafiya yawa daga tsoffi da sabbin shugabannin Najeriya suka tsunduma kawukansu a ciki,governance_civic,Corruption in Nigeria,public_interest,ethnicity,sensitive,FALSE,
Hausa,latin,Nigeria,Standard,web_public,www.bbc.com/hausa,2026-02-19,"Mai magana da yawun hukumar, Sayo Akintola, shi ne ya bayyana matakin a madadin shugabar hukumar, Farfesa Mojisola Adeyeye",media_and_online,Media and officials,public_interest,,safe,false,
Hausa,latin,Nigeria,Standard,web_public,www.bbc.com/hausa,2026-02-19,"Halima tana son wayar da kan yara game da yaran da suka rasa muhallinsu, kuma ta nuna wa yaran cewa idan har za ta samu nasarar fita daga sansanin 'yan gudun hijirar, to su ma su rika fatan wata rana za su iya fita",culture_and_religion,Caring for displaced children,public_interest,age,safe,false,
Hausa,latin,Nigeria,Standard,web_public,https://gidandabino.blogspot.com/,2026-03-04,"Game da wannan batu na abubuwan da marubuta suke bukata ta fannin gudummawa a wannan harka ta rubutu, ita ma amsar a bayyane take, kuma ba wuya gare ta ba, tun da duk marubuta sababbi da tsofaffi (na Hausa) sun san matsalar da marubuta suke fuskanta a fagen rubuce-rubuce da inganta shi da buga shi da tallata shi da sama masa tagomashi a wasu wurare, don haka da an tambayi marubuci kila zai fadi wannan miki da ya dade a zuciyarsa cikin hanzari",media_and_online,writing and publishing,public_interest,,safe,false,
Hausa,latin,Nigeria,Standard,web_public,https://www.voahausa.com/,2026-03-04,Yace wannan almundahana ce mafi girma wadda ya kamata EFCC ta dinga kalla ba lallai maganar kudi ba kawai,governance_civic,corruption and financial crimes,public_interest,,safe,false,
Hausa,latin,Nigeria,Kano,web_public,https://gidanlabarai.blogspot.com/,2026-03-06,"Kallo daya Humainah tayi mata ta dauke Kai, ta karasa kusa da ita ta durkusa a hankali tace ""Ina kwana"" ba tare da ta kalleta ba tace ""Lafiya lau"" shiru Jasmine tayi can kuma tace ""I want to help you"" mika mata wukar Humainah tayi ta ta tafi gun gas xata kunna, jasmine ta dau dankalin daya ta rasa yanda xata fara fere shi, kallon Humainah dake kokarin dauko mai tayi sannan ta fara fere dankalin ihu ta fasa ta jefar da wukan jin wani xafi da ya ratsa taMikewa Junaid dake xaune parlor yayi yana kallon kofar kitchen din jin Ihun, Humainah ta ajiye man hannunta ta taho da sauri tana kallonta tace ""Dama baki iya ba",culture_and_religion,Conversation between Humainah and Jasmine,public_interest,,safe,false,
Hausa,latin,Nigeria,Standard,web_public,https://gidanlabarai.blogspot.com/,2026-03-06,"Jasmine ta kallesa tace ""Fried rice and coconut drink Mumy tace mu yi"" yayi murmushi yace ""Good kuma kin iya yanxu?"" Girgixa masa kai tayi alamar A'a, zai yi magana junaid ya mike yace ""Toh ni xan koma"" El-ameen yace ""ohK bani makullin motata"" hade rai yayi yace ""Xan yi amfani da shi ne"" El-ameen ya mike ya warce makullin ya koma ya xauna, juyawa junaid yayi ya fice daga parlon",household_and_care,Conversation between friends,public_interest,,safe,false,
Hausa,latin,Nigeria,Standard,web_public,www.bbc.com/hausa,2026-02-19,"Cristiano Ronaldo yana ta cin kwallaye, Real Madrid na cikin matsalaLiverpool: Shin ta ɓare wa ƙungiyar ƙwallon ƙafar ne?""Likitan ya bayyana cewa bayan duba hoton raunin Kevin, zai yi jinyar mako hudu zuwa shida,"" in ji Guardiola",media_and_online,Football news and commentary,public_interest,,safe,false,
Hausa,latin,Nigeria,Standard,web_public,https://fasahar-intanet.blogspot.com/,2026-02-19,Tsarin aiwatar da kira shi ne abu na farko kuma wanda ya fi maimaituwa wajen mu'amala da kowace wayar salula,media_and_online,communication technology,public_interest,,safe,false,
Hausa,latin,Nigeria,Standard,web_public,https://www.rumbunilimi.com.ng/,2026-03-04,Ya samu kafa tarihin cewa shi ne farkon Ɗan’najeriya da ya taɓa tsayawa takarar zaɓe a jama’iyyar hamayya sannan kuma ya kayar da shugaban da ke kan karagar mulki,governance_civic,Hausa political history,public_interest,,safe,FALSE,
Hausa,latin,Nigeria,Standard,web_public,https://fasahar-intanet.blogspot.com/,2026-02-19,Wannan ke sa a kashe lokaci ana lilo a shafin Facebook amma in ban da sambatu ba abin da ake yi,media_and_online,social media usage,misinformation,,safe,false,
Hausa,latin,Nigeria,Standard,web_public,https://www.rumbunilimi.com.ng/,2026-03-04,"Wannan salon mulki a fakaice, ba a dukkan faɗin Yankin Arewan aka aiwatar da shi a lokacin da gwamna Lugga ya tsara shi ba, ya shafi iya lardunan da suke cikin Daular Usmaniyya ne",governance_civic,Governance and politics,public_interest,,safe,FALSE,
Hausa,latin,Nigeria,Standard,web_public,https://fasahar-intanet.blogspot.com/,2026-02-19,"Domin tatsuniyar Gizo, kamar yadda muka sani, ba ta wuce Ƙoƙi",culture_and_religion,Folktale of Gizo,public_interest,,safe,false,
Hausa,latin,Nigeria,Kano,web_public,https://gidanlabarai.blogspot.com/,2026-03-06,""" Tsayawa yayi da farko yana yamutse fuska ta galla masa harara, sai kuma ya shige bathroom sai amai, tana nan tsaye har ya fito, bai bari sun hada ido ba ya koma ya kwanta ya lumshe ido, tace ""Sai ka tashi mu tafi asibiti, saura in mun je ka gudo"" girgixa Kai yayi cikin sanyin murya yace ""Wllh bacci nake ji Mumy jiya ban yi bacci ba, idan na tashi sai mu je"" ta kusa minti biyar tsaye tana kallonsa bata ce komai ba, har ta ga alamar bacci ya fara daukarda, karasawa tayi ta dau wayarsa ta sa masa a silent ta ajiye sannan ta fita",health,Medical situation,public_interest,,safe,false,
a3af2c7f-167e-4b6b-94c7-e8266e44545a,hausa,latin,Nigeria,standard_hausa,media,https://www.bbc.com/hausa/articles/c62v7mx80g5o,2026-01-25T09:07:36.982Z,Masanin ya ce za a samu matsala wajen tantancewa ne kasancewar Kwankwaso ya bai wa magoya bayansa izinin cewa za su iya tafiya tare da gwamnati.,media_and_online,news_reporting,public_interest,,safe,true,,Collected from BBC Hausa
Hausa,latin,Nigeria,Standard,web_public,https://fasahar-intanet.blogspot.com/,2026-02-19,"A gaskiya fasahar Bluetooth na cikin masarrafan da basu cika samun matsala ba a wayar salula, duk yadda aka kai da amfani da su kuwa",livelihoods_and_work,Bluetooth technology,public_interest,,safe,false,
Hausa,latin,Nigeria,Unknown,web_public,https://www.rumbunilimi.com.ng/,2026-03-04,com/mark-zuckerberg-biography-[PHONE] Biography (2019),media_and_online,mark zuckerberg biography,public_interest,,safe,TRUE,
Hausa,latin,Nigeria,Standard,web_public,https://munbarin-musulunci.blogspot.com/,2026-03-04,"Mecece Sallar Idi: ''Ita sallar idi sallace da ake gabatar da ita a wani lokaci kebantacce, awata siffa kebantacciya, sau biyu a shekara''",culture_and_religion,Eid prayer,public_interest,,safe,false,
Hausa,latin,Nigeria,Standard,web_public,https://fasahar-intanet.blogspot.com/,2026-02-19,com inda za ka iya saukar da masarrafan kyauta,livelihoods_and_work,sending money as gift,public_interest,,safe,false,
Hausa,latin,Nigeria,Standard,web_public,www.bbc.com/hausa,2026-02-19,Himma dai ba ta ga rago,culture_and_religion,Himma/Effort,public_interest,,safe,false,
Hausa,latin,Nigeria,Kano,web_public,https://gidanlabarai.blogspot.com/,2026-03-06,"Kulle part dinsa yayi da makulli sannan yayi bangaren Mumy, bedroom dinta ya karasa ganin bata Palo ya sameta tana gyara kayanta a closet yace ""Mumy xan dan fita sae na dawo"" Mumy ta kallesa sannan ta ajiye kayan hannunta ganin mood dinsa tace ""Me ya faru son?"" Shiru yayi da farko sae kuma yace ""Wae shine xa su samu Abba su ce na doki Suhaima, meyasa idan basu yi karya ba basu ji ddi ba 'yan gidan nan?"" Mumy tace ""Ae tun ba yau ba na sha fada maka ka daina shiga hurumin da ba taka ba, to yanxu gashi sun hada ka da Abban ka ae"" ya fuzar da iska yace ""Na tafi Mumy sae na dawo"" tace ""Ina xaka?"" Yace ""Gidansu faisal xan je"" Mumy tace ""Toh shknn kar ka dde, and drive carefully"" yace ""Ohk Mum"" har bakin mota ta rakosa, su Umma dake xaune da Hajiya suka bi su da kallo suna tabe baki, ko kallonsu Mumy bata yi ba har Junaid ya ja motarsa ya bar gidan, Mumy ta koma part dinta, Hajiya ta sauke wani ajiyar xuciya tace ""Wannan Yaro ya xame mana babban obstacle a gidan nan wllh, komae sae yanda yace ma ubansa, idan ba ina bakin ciki da numfashin da yake a duniya ba Shegiya nake"" Umma tace ""Uhm ke ko ni, da da yanda xanyi da shi da tuni ni dae nayi wllh, don ko uwarsa bata isheni kamar yanda ya ishe ni a gidan nan ba, na tsane shi wllh wllh, ko 'ya yan mu fa Hajja bata ji da kamar yanda take ji da shi wae don yana namiji mu kuma mata gare mu"" Hajiya tace ""Toh shine kike kokarin ganin yanda xa ki cusa masa Suhaima ya aura kuma"" Umma tace ""Toh ae ke ma da xae auri Muhibba so kike naga"" Hajiya tace ""Da kenan ba yanxu ba don nasan hakan ma baxae taba yiwuwa ba, bari mu shiga ciki ki ji shawarar da na yi a kan matakin da xamu dauka kan Ahmad a gidan nan"" Umma tace ""Toh me muke a nan, mu shiga kawae ki ban in sha"" mikewa suka yi gaba daya suka yi palon Hajiya",household_and_care,family and household,public_interest,,safe,false,
Hausa,latin,Nigeria,Standard,web_public,https://munbarin-musulunci.blogspot.com/,2026-03-04,Ma'ana: Amincin Allah ya tabbata a gareka ya wannan gwarzo Umar,culture_and_religion,religious blessing,public_interest,,safe,false,
Hausa,latin,Nigeria,Standard,web_public,https://fasahar-intanet.blogspot.com/,2026-02-19,A karshe ina kara jinjina maka kan wannan jihadi da kayi wajen bada taka gudummuwar ga ci gaban addinin muslunchi,culture_and_religion,Islamic jihad efforts,public_interest,,safe,false,
Hausa,latin,Nigeria,Standard,web_public,https://www.rumbunilimi.com.ng/,2026-03-04,"An ciri a shekarar 2016, daga shafin: [URL]",media_and_online,year 2016 event,public_interest,,safe,TRUE,
Hausa,latin,Nigeria,Standard,web_public,https://munbarin-musulunci.blogspot.com/,2026-03-04,"Da yawa malamai suna cewa dukkan wanda ya bar sallah don bai dauketa komaiba da kasala da yawa malamai sukace ya bar musulunci, saboda Ma'aikin Allah tsira da amincin Allah su tabbata a gareshi yace: ''Abindake tsakanin mutum da kafirci shine barin Sallah'' Muslim:82",culture_and_religion,Abandoning daily prayers,misinformation,religion,sensitive,false,
Hausa,latin,Nigeria,Kano,web_public,https://gidanlabarai.blogspot.com/,2026-03-06,"64__65 Tashi ka je, k'asa tashi yayi Abba yace ""Baxa ka bar min parlor ba?"" A hankali yace ""Abba kayi hakuri don Allah, sharrin",household_and_care,father-son conversation,public_interest,,safe,false,
Hausa,latin,Nigeria,Standard,web_public,https://gidanlabarai.blogspot.com/,2026-03-06,"She's beautiful!"" Murmushi yayi yace ""Ohh tnxx"" kallon hotunan ta shiga yi, can ta mike da sauri tace ""Ohh this is me"" mikewa yayi ya koma kusa da ita yana kallon wayar ya ga hoto ne da yayi masu ita da Hafsat, gyada mata kai yayi yace ""Yea, ke da Hafsat"" a sanyaye ta ci gaba da kallon hotunan taga duk hotunanta ya fi yawa a wayar, ajiye wayar tayi ta koma ta xauna ta lumshe ido, yana kallonta yace ""What?"" Bude ido tayi ta girgixa masa kai cikin sanyin murya tace ""Have you taken breakfast?"" Gyada mata kai yayi yace ""Yea"" bata kuma cewa komai ba can kuma tace ""Ban san sunanka ba!"" Wara ido yayi yace ""I am El-ameen Ahmad",media_and_online,social media interactions,public_interest,,safe,false,
Hausa,latin,Nigeria,Standard,web_public,https://www.rumbunilimi.com.ng/,2026-03-04,Shi ɗa ne ga Ambasada Muhammad Aminu Sunusi,governance_civic,Ambasada Muhammad Aminu Sunusi,public_interest,,safe,FALSE,
92a31047-8d29-44d7-a0a6-7f5e82032ad5,hausa,latin,Nigeria,standard_hausa,media,https://www.bbc.com/hausa/articles/c8013e018j9o,2026-01-25T09:07:35.196Z,A duka faɗin yankin an matsar da iyakar a wurare 16.,media_and_online,news_reporting,public_interest,,safe,true,,Collected from BBC Hausa
Hausa,latin,Nigeria,Standard,web_public,https://www.rumbunilimi.com.ng/,2026-03-04,Majalisar Ƙoli (The Assembly of the Union) Majalisar ƙoli ita ce babbar majalisar Tarayyar Afirka wacce ke da alhakin ɗaukar mataki na ƙarshe a dukkan gudarwar tarayyar,governance_civic,The Assembly of the Union,public_interest,,safe,FALSE,
