language,script,country,region_dialect,source_type,source_ref,collection_date,text,domain,topic,theme,sensitive_characteristic,safety_flag,pii_removed,collector_id
Hausa,latin,Nigeria,Standard,web_public,www.bbc.com/hausa,2026-02-19,"Ji daɗine rayuwarkaBin wannan ka'ida, tattare da samun sa'a, za ka iya zama hamshakin attajiri kuma shahararre",livelihoods_and_work,Achieving wealth and fame,public_interest,,safe,false,
Hausa,latin,Nigeria,Standard,web_public,https://nuriddeen.blogspot.com/,2026-03-06,"Kafin ita, ban taba cin wani abinci ko shan wata miya mai dadi kamar nata ba",culture_and_religion,eating and drinking,public_interest,,safe,false,
Hausa,latin,Nigeria,Standard,web_public,https://munbarin-musulunci.blogspot.com/,2026-03-04,Yadda Ake Ziyara anan mutum zaizo ta gaba sai ya fuskanci qabarin Ma'aikin Allah (Tsira da amincin Allah su tabbata a gareshi) sai yace:,culture_and_religion,visiting a grave,public_interest,,safe,false,
Hausa,latin,Nigeria,Standard,web_public,https://www.rumbunilimi.com.ng/,2026-03-04,"Fulani mutane ne da suka yi fice wajen kiwon dabbobi da kuma rayuwar daji duk kuwa da cewa adadin Fulanin dajin waɗanda su ne makiyaya waɗanda aka ƙiyasta adadinsu da miliyan goma sha biyu ko goma sha uku (Wikipedia, 2019), bai kai na sauran Fulanin ba waɗanda ake ganin sun kai kimanin miliyan 38 zuwa 40 (Wikipedia, 2019) a jimillance",culture_and_religion,Fulani herdsmen and wildlife,public_interest,ethnicity,sensitive,FALSE,
Hausa,latin,Nigeria,Standard,web_public,https://www.rumbunilimi.com.ng/,2026-03-04,Sunan mahaifiyarsa Hajia Abibatu Mogaji,culture_and_religion,Person's name,public_interest,,safe,FALSE,
Hausa,latin,Nigeria,Standard,web_public,www.bbc.com/hausa,2026-02-19,Ya ce zai gabatar da ƙwararan hujjujin da za su nunawa duniya irin cuwa-cuwar da aka yi a zaɓen da zarar an dawo da Internet da aka katse a dukkanin faɗin ƙsar,media_and_online,Internet disruption and political claims,misinformation,,sensitive,false,
Hausa,latin,Nigeria,Standard,web_public,https://gidanlabarai.blogspot.com/,2026-03-06,"A gefe guda, Dino Melaye, tsohon sanata, ya gargadi Shugaban kasa Muhammadu Buhari a kan yunkurin kama limamin Katolika na Sokoto, Mathew Kukah, kan sukar gwamnati mai ci",governance_civic,political criticism,public_interest,religion,sensitive,false,
Hausa,latin,Nigeria,Sokoto,web_public,https://www.rumbunilimi.com.ng/,2026-03-04,"Daga cikin irin ƙulle-ƙulle da makirce-makircen da Yunfa ya ke yi wa Shehu, akwai wata rana da ya haƙa rami ya shimfiɗa tabarma a kan ramin sannan ya gayyaci Shehu da almajiransa cewa su zo a tattauna",culture_and_religion,Shehu and Yunfa's interactions,public_interest,,safe,FALSE,
Hausa,latin,Nigeria,Standard,web_public,https://www.rumbunilimi.com.ng/,2026-03-04,"Amma Hukumar Tsimi da Tsare-tsare ta jahar Kadunan Kaduna State Ministry of Economic Planning (2013), cewa ta yi faɗin ƙasar Kaduna yakai murabba’in kilomita 46,053 sq km wanda ya yi daidai da kashi biyar bisa ɗari (5%) na faɗin ƙasar Najeriya",governance_civic,Kaduna state geography,public_interest,,safe,FALSE,
Hausa,latin,Nigeria,Standard,web_public,www.bbc.com/hausa,2026-02-19,"Osun na da 27, Edo 25, Ondo 14, Sokoto 12, Zamfara 10, Bauchi 8, Imo 5, Jigawa da Ekiti da Borno an samu mutum 4 kowace jiha sai kuma Neja mai mutum 2",governance_civic,State population figures,public_interest,,safe,false,
Hausa,latin,Nigeria,Kano,web_public,https://gidanlabarai.blogspot.com/,2026-03-06,""" Wani tafarfasa xuciyar junaid yake, El-ameen ya tabe baki yace ""If you like kar ka fito muyi me ya kawo mu bar garin nan"" daga haka yayi ficewarsa ya barsa gun tsaye, tsaye ya ga Zahrahn tana jiransu ga dukkan alama taji abinda suka ce, murmushi ya mata yana fatan Allah yasa ba jin dai tayi ba",culture_and_religion,Interpersonal communication,public_interest,,safe,false,
Hausa,latin,Nigeria,Standard,web_public,https://www.rumbunilimi.com.ng/,2026-03-04,Ranar A ranar 18/2/2016,culture_and_religion,Date,public_interest,,safe,FALSE,
Hausa,latin,Nigeria,Standard,web_public,https://www.rumbunilimi.com.ng/,2026-03-04,"Sarautar Inyamuri Masana irin su Ibenekwu (2017) da kuma Osabiya (2017), sun siffanta salon mulkin Inyamurai kafin zuwan Turawa da salon mulkin tarayya da kuma dimokuraɗiyya wanda yake cike da daidaito; daidaito da ma’ana ta rarraba damar shugabanci ga duk wanda ya cancanta ba tare da la’akari da fifikon damar da wani yake da ita a kan wani ba",governance_civic,Hausa traditional leadership and governance,public_interest,,safe,FALSE,
Hausa,latin,Nigeria,Standard,web_public,https://kimiyyah.blogspot.com/,2026-03-04,"Ya yi bayani mai tsawo a cikin littafinsa mai suna: ""Maddarijus Saalikeen, Baina Manaazili Iyyaaka Na'abudu wa Iyyaaka Nasta'een,"" wanda sharhi ne na littafin Imamul Harwee kan dabi'un zuci, masu karfafa imani da alaka tsakanin bawa da Ubangijinsa",culture_and_religion,Islamic book and teachings,public_interest,,safe,false,
Hausa,latin,Nigeria,Standard,web_public,https://fasahar-intanet.blogspot.com/,2026-02-19,Wai duk nan yabonta ake,culture_and_religion,praise and appreciation,public_interest,,safe,false,
Hausa,latin,Nigeria,Unknown,web_public,https://www.rumbunilimi.com.ng/,2026-03-04,ng/2014/02/24/centenary-fg-honour-100-nigerians-abacha-obasanjo-ojukwu-make-list-see-list/ Ojetola B,culture_and_religion,Centenary celebration,public_interest,,safe,FALSE,
Hausa,latin,Nigeria,Unknown,web_public,https://www.rumbunilimi.com.ng/,2026-03-04,Matthew-Daniel B,culture_and_religion,name,specialized_advice,,safe,FALSE,
Hausa,latin,Nigeria,Standard,web_public,https://www.rumbunilimi.com.ng/,2026-03-04,"Mark Zuckerberg Hoto: ABC News Bayan fitarsa daga makaranta, sai ya tafi Palo Alto da ke California, ya kama hayar shago",media_and_online,Mark Zuckerberg's education and career,public_interest,,safe,FALSE,
Hausa,latin,Nigeria,Standard,web_public,https://fasahar-intanet.blogspot.com/,2026-02-19,"A bari sai caji yayi kasa, sai a sa",livelihoods_and_work,agricultural work,public_interest,,safe,false,
Hausa,latin,Nigeria,Standard,web_public,https://www.rumbunilimi.com.ng/,2026-03-04,"Smith (1970), ya ruwaito cewa, Turawa sun ci masarautun Zazzau, Kwantagora, Kano, Sakkwato, Bauchi, da sauransu da yaƙi a cikin shekaru uku bayan shelanta Yankin Arewa da Lugard ya yi",governance_civic,Colonial conquest of northern Nigeria,public_interest,,safe,FALSE,
Hausa,latin,Nigeria,Standard,web_public,https://gidandabino.blogspot.com/,2026-03-04,"Kana manyan marubutan da suka fara kawo salon rubutun da a yanzu aka fi raja'a a kan sa, su rinka jan mu kananan marubuta suna dada tunasar da mu irin nauyin da yake kan marubuci",education,Encouraging young writers,public_interest,,safe,false,
Hausa,latin,Nigeria,Standard,web_public,https://www.rumbunilimi.com.ng/,2026-03-04,"Shekarar 2011, ya sake yin takara wannan karon kuma a sabuwar jamaiyyarsa ta CPC mai alamar alƙami",governance_civic,political campaign,public_interest,,safe,FALSE,
Hausa,latin,Nigeria,Standard,web_public,https://ibrahim-sheme.blogspot.com/,2026-03-06,"Sai dai wani abin lura shi ne Dakta Aliyah ta sanar da mu cewa ba wannan ba ce gasa ta farko irin ta, an yi wasu gasannin har sau biyu a baya, waɗanda ba East ɗin ne ya shirya su ba",health,medical announcement,public_interest,,safe,false,
Hausa,latin,Nigeria,Kano,web_public,https://gidanlabarai.blogspot.com/,2026-03-06,"jay, ita Hajja bata san komai ba sai dai tayi ta magana"" Junaid xai yi magana Humainah ta shigo palon fuskar nan nata a daure ta xauna gefen Hajja, Hajja tace ""ke kuma fa?",culture_and_religion,conversation among individuals,public_interest,,safe,false,
Hausa,latin,Nigeria,Unknown,web_public,https://www.rumbunilimi.com.ng/,2026-03-04,Macmillan and Co,livelihoods_and_work,Publishing,public_interest,,safe,FALSE,
hausa,latin,Nigeria,Kano,web_public,https://twitter.com/umar_aliman/status/2016562515157692612,2026-01-28,"[USER] In sha Allah, this time around ma xamu sake kafa wata gwamnati a kano. Tabbas an fama mana ciyo a xuciya amma bakomai.",governance_civic,government formation in Kano,public_interest,,safe,true
Hausa,latin,Nigeria,Standard,web_public,https://fasahar-intanet.blogspot.com/,2026-02-19,Abu na farko shi ne ci gaban tattalin arzikin kasa,livelihoods_and_work,economic development,public_interest,,safe,false,
Hausa,latin,Nigeria,Unknown,web_public,https://fasahar-intanet.blogspot.com/,2026-02-19,[PHONE],media_and_online,phone,public_interest,,safe,true,
Hausa,latin,Nigeria,Kano,web_public,https://www.rumbunilimi.com.ng/,2026-03-04,"Alhaji Aminu Ado Bayero shi ne ya zama sarki na farko a wannan masarauta, sannan kuma bayan ɗaukaka likafarsa zuwa kan kujerar da mahaifinsa ya bari, Alhaji (Dr) Ado bayero; wato naɗin da aka yi masa a matsayin sabon sarkin Kano na goma sha biyar a cikin jerin sarakunan Fulani a Kano, sai ƙaninsa Alhaji Nasir Bayero ya maye gurbinsa",culture_and_religion,Succession of Kano Emirate,public_interest,,safe,FALSE,
Hausa,latin,Nigeria,Standard,web_public,https://www.rumbunilimi.com.ng/,2026-03-04,Ya samu wannan horo har zuwa 1964,education,education and training,public_interest,,safe,FALSE,
Hausa,latin,Nigeria,Standard,web_public,https://gidanlabarai.blogspot.com/,2026-03-06,""" El-ameen ya sauke ajiyar xuciya yace ""Good!",culture_and_religion,positive emotional response,public_interest,,safe,false,
Hausa,latin,Nigeria,Standard,web_public,https://fasahar-intanet.blogspot.com/,2026-02-19,Bin ka'ida wajen kunnawa da kashe waya na daga cikin abubuwan da ke kara mata dogon kwana a hannunka,livelihoods_and_work,mobile phone usage,public_interest,,safe,false,
Hausa,latin,Nigeria,Bauchi,web_public,https://www.rumbunilimi.com.ng/,2026-03-04,"Haka nan idan aka juya gefen Bauchi, can ma mayaƙan Misau sun kaiwa Bauchin hari",governance_civic,Bauchi and Misau conflict,public_interest,,safe,FALSE,
Hausa,latin,Nigeria,Standard,web_public,https://www.rumbunilimi.com.ng/,2026-03-04,"Sannan kuma a lokaci guda, tabbataccen ciyaman (full time chairman) na kwamatin shirye-shiryen halartar taron duniya karo na biyu, na bukukuwan wasannin gargajiya da al’adu na baƙaƙen fatar Afirka (Second World Black and African Festivals of Arts and Culture)",culture_and_religion,World Black and African Festivals,public_interest,,safe,FALSE,
Hausa,latin,Nigeria,Standard,web_public,www.bbc.com/hausa,2026-02-19,Ƙaramar ƙasar mai arzikin fetur a yankin Gulf kamar almara ne ga yanayin da har wani zai aiwatar da irin wannan mummunan aiki,livelihoods_and_work,Oil-rich Gulf region,public_interest,,safe,false,
Hausa,latin,Nigeria,Standard,web_public,https://www.voahausa.com/,2026-03-04,"Josef Bican ne ke gaba da yawan kwallaye da ba a tabbatar ba, amma rahotanni sun yi kiyasin yana da kwallaye akalla 805",livelihoods_and_work,football player statistics,public_interest,,safe,false,
Hausa,latin,Nigeria,,web_public,www.bbc.com/hausa,2026-02-19,"""Yancin nuna farin ciki da annashuwa kan musifar da ta samu mutum na da matukar ban mamaki,"" in ji Musk",,,,,safe,false,
Hausa,latin,Nigeria,Kano,web_public,https://gidanlabarai.blogspot.com/,2026-03-06,""" Wani shewa tayi ta karaso ta rungumeta tace ""Ikon Allah, dama idan Allah ya so ka da arxiki duk nacin mahassadi sai dai ya mutu don sai kayi arxikin nan, sannu yar sarki jikar sarki, kiri kiri suka gudu suka bar ni sai gashi kin xo daukata",culture_and_religion,Magical power and superstition,stereotypes,supernatural,sensitive,false,
Hausa,latin,Nigeria,Standard,web_public,https://fasahar-intanet.blogspot.com/,2026-02-19,Amma idan kana son hana hakan,culture_and_religion,conditional permission,public_interest,,safe,false,
Hausa,latin,Nigeria,Standard,web_public,https://fasahar-intanet.blogspot.com/,2026-02-19,"In har wannan ne matsalarka, to a gaskiya ba wata matsala bace kamar yadda kake riyawa",household_and_care,personal problem,public_interest,,safe,false,
Hausa,latin,Nigeria,Standard,web_public,www.bbc.com/hausa,2026-02-19,"ONEAsalin hoton, Abdul OneBayanan hoto, xFitaccen matashin mawaƙi Abdul D",media_and_online,photo,public_interest,,safe,false,
Hausa,latin,Nigeria,Standard,web_public,www.bbc.com/hausa,2026-02-19,Yana mai cewa kawai ɓata suna ne da ake so a yi masa a siyasance,governance_civic,political affairs,misinformation,,sensitive,false,
Hausa,latin,Nigeria,Standard,web_public,https://www.rumbunilimi.com.ng/,2026-03-04,Jaridar Financial Times,media_and_online,Financial Times newspaper,public_interest,,safe,FALSE,
Hausa,latin,Nigeria,Kano,web_public,https://gidanlabarai.blogspot.com/,2026-03-06,""" Shiru tayi sai kuma a hankali tace ""In je?"" Gyada mata kai yayi ta juya ta koma part din Mumy, tafiyarta kawai yake kallo har ta isa kofa ta murda a hankali ta tura ta shiga, durkushe ta gansa a parlon kusa Humainah dake kwance kan doguwar kujera idonta lumshe, tsaye tayi bakin kofar ta kasa karasowa, kallo daya yayi mata ya dauke kai, Dakewa tayi ta karaso parlon cikin rashin kuxari, dai dai lokacin da Humainah ta mike xaune da sauri, ya mike ya xauna gefenta yana kallonta ganin yanda ta rame, hannunta ya rike kamar bai son magana don bakinsa kadai yayi motsi yace ""What wife!"" Ta dafe kanta bata ce komai ba, can ta d'ago da kyar tace ""Amai nake ji"" mikewa yayi ya daga ta suka bar parlon, ita ko lura da Zahrah da tayi still tana kallon ikon Allah bata yi ba har ya shiga da ita daki, Zahrah taji ta ma kasa tsayuwar, tunda take bata taba jin abinda ta ji a lokacin a xuciyarta ba, kawai ji tayi hawaye ya cika idonta, ta juya da sauri har tana neman faduwa ta fice daga parlon",household_and_care,Visiting a friend,public_interest,,safe,false,
Hausa,latin,Nigeria,Standard,web_public,https://fasahar-intanet.blogspot.com/,2026-02-19,"Sau tari ana mini filashin, har yanzu ba a daina ba",livelihoods_and_work,Ongoing challenge,public_interest,,safe,false,
Hausa,latin,Nigeria,Standard,web_public,www.bbc.com/hausa,2026-02-19,Sannan hakan ya sa an sami cigaba wajen samar da hanyoyin nuna shirye-shiryen fim ta manhajar YouTube,media_and_online,creating video content,public_interest,,safe,false,
Hausa,latin,Nigeria,Kano,web_public,https://www.rumbunilimi.com.ng/,2026-03-04,org/wiki/Bala_Usman Shafin Tarihi Shafin Tarihi Mashahuran Mutane Sir Ahmadu Bello Tanko Yakasai Adamu Chiroma Ɗanmasanin Kano TY Ɗanjuma Alh,culture_and_religion,Prominent Hausa people,public_interest,,safe,FALSE,
Hausa,latin,Nigeria,Standard,web_public,www.bbc.com/hausa,2026-02-19,"(Metro)Babban LabariPantami ya ce dole a yi wa jami'an diflomasiyya NINSa'o'i 2 da suka wuceYadda aka saki 'yan kasuwar Kantin Kwari bayan biyan kuɗin fansaSa'o'i 5 da suka wuceBiden zai soke dokar hana wasu ƙasashen musulmai shiga Amurka17 Janairu 2021Minti Daya Da BBC1:07Saurari, Minti Daya da BBC Safe 15/01/2021, Tsawon lokaci 1,07Minti Ɗaya da BBC na Safiyar 15/01/2021, wanda nabela Mukhtar Uba da Sani Aliyu su ka karanto",governance_civic,"Diplomatic IDs, Kwari market, Biden immigration policy",public_interest,,safe,false,
Hausa,latin,Nigeria,Standard,web_public,https://www.rumbunilimi.com.ng/,2026-03-04,Northern Nigerian Publishing Company Ltd,livelihoods_and_work,publishing company,public_interest,,safe,FALSE,
Hausa,latin,Nigeria,Standard,web_public,www.bbc.com/hausa,2026-02-19,"Ƙarin labarai masu alaƙaHikayata 2020: Labarin 'Rai da Cuta' da ya zo na ɗayaHikayata 2020: Gwarzuwar gasar ta biyu ta samu tallafin karatuBabban LabariKAI TSAYE Jami'ar Bayero za ta fara koyar da darusa ta hanyar intanetShahararren ɗan jaridar Amurka Larry King ya rasuSa'o'i 6 da suka wuceHar yanzu Dangote ne ya fi kowa arziki a AfrikaSa'o'i 9 da suka wuceMinti Daya Da BBC1:13Saurari, Minti Daya da BBC Safe 23/01/2021, Tsawon lokaci 1,13Minti Ɗaya Da BBC na Safiyar 23/01/2021, wanda Nabeela Mukhtar Uba da Sani Aliyu su ka karanto",media_and_online,Hausa news and events,public_interest,,safe,false,
Hausa,latin,Nigeria,Standard,web_public,https://www.voahausa.com/,2026-03-04,"To saidai Mahmud ya ce akwai nasaba tsakanin muradun baya da na yanzu ta bangarorin daban-daban, hasalima, wasu daga cikin muradu 17 su na kuma cikin 8 da su ka gabata",livelihoods_and_work,Differences between past and current goals,public_interest,,safe,false,
Hausa,latin,Nigeria,Standard,web_public,www.bbc.com/hausa,2026-02-19,"Dan majalisa na Democrat daga South Carolina Jim Clyburn, ya shaida wa manema labarai cewa an sace masa komfutar iPad, amma daga baya wani mai taimaka masa ya ce ""tana nan ba abin da ya same ta",governance_civic,Computer theft,public_interest,,safe,false,
Hausa,latin,Nigeria,Kano,web_public,https://gidanlabarai.blogspot.com/,2026-03-06,"Tana idar da sllh tayi jigum kan darduma, can ta mike ta shiga gyaran bedroom din, tana gamawa ta shiga bayi ta wanke baki tayi wanka ta wanke bayin ta fito daure da towel, gaban mirror ta xauna ta gama shafe shafenta sannan ta shirya cikin Abaya baki da veil dinsa ta d'an gyara fuskarta ta koma gado ta xauna tayi tagumi",household_and_care,Daily household activities,public_interest,,safe,false,
Hausa,latin,Nigeria,Standard,web_public,https://gidanlabarai.blogspot.com/,2026-03-06,"Ko a kanki take xaune"" dago kai tayi tana kallonsa, ya watsa mata wani kallo ya juya ya fice daga dakin, wani sabon kukan ta fashe da har da shessheka",culture_and_religion,Romantic interaction,public_interest,,safe,false,
Hausa,latin,Nigeria,Standard,web_public,https://kimiyyah.blogspot.com/,2026-03-04,Wato bacci na hakika kenan,culture_and_religion,sleep,public_interest,,safe,false,
Hausa,latin,Nigeria,Standard,web_public,https://www.rumbunilimi.com.ng/,2026-03-04,Sunan wannan mata Pythias,culture_and_religion,personal name,public_interest,,safe,FALSE,
hausa,latin,Nigeria,Kano,web_public,https://twitter.com/halal_parrot/status/2016671184142643552,2026-01-29,"[USER] [USER] Bamu da aiki sai kushe namu, sister Allah Ya miki albarka. A tunanin ku duk abubuwan da take yi basa tafiya in line with ethics din profession din ta ne ko dai ku ne kuka ci kai? Menene laifin ta? Ku duba sauran media outlets ku ga yadda ake hira mana, komi sai mun yi shisshigi",livelihoods_and_work,Work and ethics,public_interest,,sensitive,true
Hausa,latin,Nigeria,Standard,web_public,https://fasahar-intanet.blogspot.com/,2026-02-19,"Cikin kashi 100 na kamfanonin da suka fi yawan dukiya a duniya, kashi 48 na da shafi a Dandalin Google+",livelihoods_and_work,Top companies by wealth,public_interest,,safe,false,
Hausa,latin,Nigeria,Standard,web_public,https://fasahar-intanet.blogspot.com/,2026-02-19,"Na'am, tabbas haka ne",culture_and_religion,confirmation statement,public_interest,,safe,false,
Hausa,latin,Nigeria,Standard,web_public,www.bbc.com/hausa,2026-02-19,"'An tilastawa Musulmai yin sallah a waje' Wani mazaunin birnin mai suna Abdu Mohammed Ali, mai shekara 40, ya ce shekara da shekaru zuriyar gidansu na karbar hayar gidaje ne daga Kirista dan samar da masallacin da za su yi sallah da sauran ibada",culture_and_religion,Muslim prayer,public_interest,,safe,false,
Hausa,latin,Nigeria,Standard,web_public,www.bbc.com/hausa,2026-02-19,"Hatta a wata uku na farkon shekarar 2020 ma wato shekarar da annobar korona ta shigo, yana ci gaba da bunƙasa",health,Corona virus progress,public_interest,,safe,false,
Hausa,latin,Nigeria,Unknown,web_public,https://www.rumbunilimi.com.ng/,2026-03-04,Theophilus Danjuma,culture_and_religion,personal name,public_interest,,safe,FALSE,
hausa,latin,Nigeria,Standard,web_public,https://twitter.com/Muhammad_ks02/status/2015810329301692755,2026-01-26,[USER] Wai budurwa yace kokuma mahaifiya,culture_and_religion,Motherhood,stereotypes,gender,sensitive,true
Hausa,latin,Nigeria,Kano,web_public,https://gidanlabarai.blogspot.com/,2026-03-06,"No I helped her wai ta mance gidansu,"" wani kallo yake masa kafin ya juya ya fita, ya koma dakin da Jasmine take, cikin dakin ya karasa yana kallonta yace ""daga ina kike?"" Kallonsa tayi ta ajiye spoon din hannunta tace ""Daga gidan uncle"" yace ""xa ki ina?"" Tace ""Gidan Captain!"" yace ""Toh me ya kawo ki nan?"" Ta kalli kofar dakin tace ""Wani mutum ne"" yace ""A ina ya gan ki?"" Xata yi magana Abdul ya shigo dakin, yana kallon yayansa, Jasmine tace ""Ga shi nan"" Yayan nasa me suna Aliyu yace ""I gat you will one day bring what will lead you to ur grave Abdul, you saw a gal like this on the road, she lied to you, you picked her up nd brought her home ryt?"" mikewa Jasmine tayi kamar xata yi kuka tace ""Am not lying, am not a liar",culture_and_religion,social interactions and conversation,public_interest,,safe,false,
Hausa,latin,Nigeria,Kano,web_public,https://gidanlabarai.blogspot.com/,2026-03-06,"Washegari da yamma junaid na kwance bayan ya dawo daga aiki El-ameen ya shigo parlon, kallo daya ya masa ya dauke kai, El-ameen na daga tsaye bakin kofa yace ""In ka shirya ka taso mu tafi"" ko kallonsa junaid bai yi ba, El-ameen yace ""Ohk nayi tafiya ta"" daga haka ya fice",household_and_care,Evening scene at home,public_interest,,safe,false,
Hausa,latin,Nigeria,Bauchi,web_public,https://gidanlabarai.blogspot.com/,2026-03-06,""" Sarki ya kalli Junaid yace ""Toh karaso ka xauna Ahmad"" tsaye junaid yayi kamar baxai karasa parlon ba gashi gabansa sae faduwa yake ya rasa dalili, sarkin bauchi kuma, is she related to the royal family?",culture_and_religion,Interaction between Sarki and Junaid,public_interest,,safe,false,
Hausa,latin,Nigeria,Kano,web_public,https://gidanlabarai.blogspot.com/,2026-03-06,"suna isa El-Ameen yace ""Baka yi min transfer din kudin Television din ba fa, if you provoke me xan fa je in siya da kudina"" Junaid yace ""I forgot xan yi"" fitowa suka yi daga motar suka shiga gidan, Mama jummai na xaune parlor ta daura kanta kan cinyarta idonta rufe, El-Ameen yace ""dama tana bacci ba da daddare ba"" Mama jummai tace ""Ina jin bata jin dadi ne yau, sau biyu tana amai ga jikinta da dumi, ita da ko xama bata yi da rana bare ta kwanta"" El-Ameen ya karasa ya durkusa gabansu ya d'ago kanta ta bude ido tana kallonsa, ya gyara mata gashinta a hankali yace ""Malaria",livelihoods_and_work,Financial dispute,public_interest,,sensitive,false,
Hausa,latin,Nigeria,Kano,web_public,https://www.rumbunilimi.com.ng/,2026-03-04,"Haihuwa An haifi Suleimanu a garin Kano, shi ɗa ne ga Isa Wali",culture_and_religion,Birth and Lineage,public_interest,,safe,FALSE,
Hausa,latin,Nigeria,Standard,web_public,www.bbc.com/hausa,2026-02-19,"""Wadannan yaran kamar ba su ba ne suka ci 7-0 a baya, idan muna so mu ci gaba da irin wannan nasarar sai mun kara dagewa",media_and_online,Football match result,public_interest,,safe,false,
Hausa,latin,Nigeria,Standard,web_public,https://www.rumbunilimi.com.ng/,2026-03-04,Ya fara karatunsa tun yana ɗanƙarami da karatun Alƙur’ani mai girma kamar yadda aka saba,culture_and_religion,Quranic education,public_interest,,safe,FALSE,
Hausa,latin,Nigeria,Standard,web_public,www.bbc.com/hausa,2026-02-19,"Jihar Plateau na da mutum 60, Kaduna 54, Kano kuma 40",livelihoods_and_work,Population statistics,public_interest,,safe,false,
Hausa,latin,Nigeria,Standard,web_public,https://www.voahausa.com/,2026-03-04,"A kan hanyarsa ta komawa fadar White House, shugaban kasar ya sake bi inda mutanen suke ya yi musu shewa na nuna goyon baya, a cewar labaran Fox",governance_civic,White House visit,public_interest,,safe,false,
Hausa,latin,Nigeria,Standard,web_public,https://fasahar-intanet.blogspot.com/,2026-02-19,Kuma wanda ka tura masa zai gani rangadau?,culture_and_religion,seeing someone,public_interest,,safe,false,
Hausa,latin,Nigeria,Kano,web_public,www.bbc.com/hausa,2026-02-19,"Rahama Sadau da Maryam Sanda na cikin mutanen da suka fi tashe a intanet a Najeriya a 2020Kannywood: Hadiza Gabon ce ta fi fice a Google a 2019Fina-finan Kannywood 10 da suka fi shahara a 2019Dafin SoAsalin hoton, Dafiin SoA fim ɗin, Bashir (Adam A",media_and_online,Kannywood celebrities and films,public_interest,,safe,false,
Hausa,latin,Nigeria,Standard,web_public,www.bbc.com/hausa,2026-02-19,Amma Hamad ɗaya daga cikin ƴan Bidoon ne da ba su da ƙasa,culture_and_religion,Bidoon population,public_interest,ethnicity,sensitive,false,
Hausa,latin,Nigeria,Standard,web_public,www.bbc.com/hausa,2026-02-19,"Asalin hoton, ReutersBayanan hoto, Gwamnatin Trump ta sasanta Isra'ila da wasu kasashen LarabawaKammala wasu kasuwanci da kawo karshen yake-yaken Iraki da Syria da kuma na Falasdinawa da Isra'ila, ga sabon kalubalen da ake fuskanta a Lebanon; kawo karshen barazanar al-Qaeeda da kuma IS ba karamin aiki ba ne ga gwamnatin da take fuskantar nata matsalolin na cikin gida",governance_civic,Politics and international relations,public_interest,,safe,false,
Hausa,latin,Nigeria,Standard,web_public,www.bbc.com/hausa,2026-02-19,"Harsasan da aka kama a wannan karo dai ana safarar su ne a cikin kasa, ba kamar yadda akan kama wasu da kan yi kokarin shigowa da su daga kasashen ketare ba",governance_civic,Crime and Policing,public_interest,,safe,false,
Hausa,latin,Nigeria,Standard,web_public,https://kimiyyah.blogspot.com/,2026-03-04,"Wanda ya fara bincike kan wannan bangare kuwa shi ne Thomas Hunt, inda ya gano cewa lallai bangaren Ma'adanar Dabi'ar Halitta (Chromosome) ne ke dauke da wadannan dabi'un halitta masu haddasa gadon dabi'un halitta a tsakanin halittu masu rai",health,Genetic research,specialized_advice,,safe,false,
Hausa,latin,Nigeria,Standard,web_public,www.bbc.com/hausa,2026-02-19,Iyayensa ba su da ƙarfin ɗaukar nauyin karatunsa,household_and_care,Family responsibilities,public_interest,,safe,false,
Hausa,latin,Nigeria,Standard,web_public,www.bbc.com/hausa,2026-02-19,"Duk da waɗannan ƙalubale da Biden ya fuskanta, a yanzu ya zama shugaban Amurka yana da shekara 78",governance_civic,Joe Biden's presidency,public_interest,,safe,false,
