id,language,script,country,region_dialect,source_type,source_ref,collection_date,text,domain,topic,theme,sensitive_characteristic,safety_flag,pii_removed,collector_id,notes
f61651ec-44b6-4bdb-a6b4-e4c8295ed07c,hausa,latin,Nigeria,standard_hausa,media,https://www.bbc.com/hausa/articles/cy9ygw9p1v2o,2026-01-25T09:06:09.031Z,"Da alama jam'iyyar APC da gwamnatinta a Najeriya, sun fara juyawa ministan Abuja, babban birnin tarayyar kasar, Nyesom Wike, baya sannan kuma sun jaddada goyon bayansu ga gwamnan jihar Rivers, Siminalayi Fubara, wanda bai dade da komawa jam'iyyar ta APC daga PDP ba.",media_and_online,news_reporting,public_interest,,safe,true,,Collected from BBC Hausa
81ce2a4e-931c-485a-8db8-bb786f6ce69c,hausa,latin,Nigeria,standard_hausa,media,https://www.bbc.com/hausa/articles/cy9ygw9p1v2o,2026-01-25T09:06:09.034Z,"Hakan ya fara nuna yadda ake neman raba gari da ministan, sakamakon yadda ake ta bayyana fargabar kar ya zame wa jam'iyyar APC da gwamnatinta wani babban alakakai a fagen siyasar jihar.",media_and_online,news_reporting,public_interest,,safe,true,,Collected from BBC Hausa
29955951-43f5-44ee-b80a-08211557cace,hausa,latin,Nigeria,standard_hausa,media,https://www.bbc.com/hausa/articles/cy9ygw9p1v2o,2026-01-25T09:06:09.035Z,"Tun ana gunaguni da nuna gundura ta hanyar balulluba ko a kaikaice, game da yadda aka soma gajiya da tafiya irin ta angulu da kan zabo da ake yi da ministan na Abuja, asali dan jam'iyyar PDP, da gwamnatin tarayya ta jam'iyyar APC, yanzu abin ya fara fitowa fili.",media_and_online,news_reporting,public_interest,,safe,true,,Collected from BBC Hausa
da3bc81a-2d49-44c0-8c88-bcf61b02ea80,hausa,latin,Nigeria,standard_hausa,media,https://www.bbc.com/hausa/articles/cy9ygw9p1v2o,2026-01-25T09:06:09.036Z,"Da sannu a hankali kusoshin jam'iyyar APC da mukarraban gwamnatinta suna ta jaddada rungumar dan lele wato gwamnan jihar Rivers, Siminalayi Fubara, tare da nuni cewa, shi ne babban jigon jam'iyyar a jihar.",media_and_online,news_reporting,public_interest,,safe,true,,Collected from BBC Hausa
857c583d-71b2-44d8-b589-ab1b3d688c2b,hausa,latin,Nigeria,standard_hausa,media,https://www.bbc.com/hausa/articles/cy9ygw9p1v2o,2026-01-25T09:06:09.037Z,"Bala Ibrahim, daraktan yada labarai na jam'iyyar APC na kasa, ya shaida wa BBC cewa idan aka dubi tsarin zababbu a jihar ta Rivers, Fubara shi ne gwamna, don haka shi ne jagoran jam'iyyar APC a Rivers.",media_and_online,news_reporting,public_interest,,safe,true,,Collected from BBC Hausa
53b0080a-15fe-4ee2-b527-8c0fc74da12d,hausa,latin,Nigeria,standard_hausa,media,https://www.bbc.com/hausa/articles/cy9ygw9p1v2o,2026-01-25T09:06:09.038Z,"Ya ce,"" Shi Wike ba dan jam'iyyar APC ba ne, kuma tun da ba dan jam'iyya ba ne ai ba yadda za a yi ya yi ruwa ya yi tsaki a cikin harkarmu ta jam'iyya.""",media_and_online,news_reporting,public_interest,,safe,true,,Collected from BBC Hausa
7751ecd5-2f90-40b3-ab17-eb27c8ec6a56,hausa,latin,Nigeria,standard_hausa,media,https://www.bbc.com/hausa/articles/cy9ygw9p1v2o,2026-01-25T09:06:09.039Z,"Masana siyasa a Najeriya irinsu Farfesa Abubakar Umar Kari, da ke jami'ar Abuja, sun bayyana abin da wannan fifiko da ake nuna wa Fubara ke nufi inda ya ce abubuwa ne guda biyu.",media_and_online,news_reporting,public_interest,,safe,true,,Collected from BBC Hausa
74910158-d5ed-4129-baf4-3076721440cf,hausa,latin,Nigeria,standard_hausa,media,https://www.bbc.com/hausa/articles/cy9ygw9p1v2o,2026-01-25T09:06:09.040Z,""" Na farko shi ne gasgata zaton mutane da dama cewa 'ya'yan jam'iyyar APC fa ba sa jin dadin irin kutse da wasu abubuwa da Wike ke yi, inda har ma sun fara fitowa fili suna fada inda suke masa hannunka mai sanda kan cewa ba sa kaunarsa.""",media_and_online,news_reporting,public_interest,,safe,true,,Collected from BBC Hausa
6b8e2fd4-2532-477d-9d74-936312b3f15b,hausa,latin,Nigeria,standard_hausa,media,https://www.bbc.com/hausa/articles/cy9ygw9p1v2o,2026-01-25T09:06:09.041Z,"""Na biyu kuma shi ne, kusan kullum tana fitowa fili cewa Wike na da babban zabi a gabansa, wato ko dai ya koma jam'iyyar APC, ko kuma ya ci gaba da zama a jam'iyyarsa ta PDP, amma kuma ya bar mukaminsa na minista.",media_and_online,news_reporting,public_interest,,safe,true,,Collected from BBC Hausa
602ef41a-6456-42de-9216-9983d1bd2668,hausa,latin,Nigeria,standard_hausa,media,https://www.bbc.com/hausa/articles/cy9ygw9p1v2o,2026-01-25T09:06:09.041Z,"Domin idan har ya ci gaba da kasancewa minista to za a ci gaba da kalubalantarsa."" In ji shi.",media_and_online,news_reporting,public_interest,,safe,true,,Collected from BBC Hausa
717186a2-dd9d-4138-aeba-d4cef4b463b1,hausa,latin,Nigeria,standard_hausa,media,https://www.bbc.com/hausa/articles/cy9ygw9p1v2o,2026-01-25T09:06:09.042Z,"Yanzu dai bisa ga dukkan alamu, ministan Abuja, babban birnin tarayyar Najeriya, Nyesom Wike, yana cikin tsaka mai wuya a siyasance sakamakon yadda yake fama da rikici a jam'iyyarsa ta PDP, sannan kuma a jam'iyyar APC da yake yi wa aiki kuma, ana yi masa kallon wani sartse.",media_and_online,news_reporting,public_interest,,safe,true,,Collected from BBC Hausa
0309d010-b90b-427e-9018-3dbdf40e6d7b,hausa,latin,Nigeria,standard_hausa,media,https://www.bbc.com/hausa/live/c368rn00zxgt,2026-01-25T09:06:09.611Z,Wannan shafi ne da ke kawo mu ku labaran abubuwan da ke faruwa a Najeriya da sauran sassan duniya,media_and_online,news_reporting,public_interest,,safe,true,,Collected from BBC Hausa
bee222b3-8f9b-4bf2-9e77-cdf727c69df6,hausa,latin,Nigeria,standard_hausa,media,https://www.bbc.com/hausa/live/c368rn00zxgt,2026-01-25T09:06:09.615Z,"An hana ƴan jarida a Tanzaniya halartar zaman kwamitin bincike kan rikicin da ya biyo bayan zaɓen shugaban ƙasa, yayin da waɗanda rikicin ya rutsa da su ke bayar da shaida.",media_and_online,news_reporting,public_interest,,safe,true,,Collected from BBC Hausa
0b2f2686-45a5-4ad2-9164-7118041fd443,hausa,latin,Nigeria,standard_hausa,media,https://www.bbc.com/hausa/live/c368rn00zxgt,2026-01-25T09:06:09.616Z,"Kwamitin da shugaba Samia Suluhu ta kafa, na gudanar da bincike a kan rikicin da nufin gano musabbabin sa da kuma ba da shawarar hanyoyin da za a bi wajen samar da sulhu a ƙasar.",media_and_online,news_reporting,public_interest,,safe,true,,Collected from BBC Hausa
37abad87-8e88-493c-baa8-52ab81e91444,hausa,latin,Nigeria,standard_hausa,media,https://www.bbc.com/hausa/live/c368rn00zxgt,2026-01-25T09:06:09.617Z,"An buɗe zaman farko ga manema labarai, kuma duka kafafen yaɗa labarai na gida da na waje sun ba da rahoto kan shaidar waɗanda abin ya shafa.",media_and_online,news_reporting,public_interest,,safe,true,,Collected from BBC Hausa
785c9c3d-9cb8-4b51-a366-4239497639c5,hausa,latin,Nigeria,standard_hausa,media,https://www.bbc.com/hausa/live/c368rn00zxgt,2026-01-25T09:06:09.618Z,Sai dai kuma ƴan jarida da wasu kafafen yaɗa labarai sun ce ba a ba su damar halartar tarukan da suka biyo biyo baya ba ranar Asabar.,media_and_online,news_reporting,public_interest,,safe,true,,Collected from BBC Hausa
7aa9bf1f-cec0-4006-be47-4c3b74df3e7a,hausa,latin,Nigeria,standard_hausa,media,https://www.bbc.com/hausa/live/c368rn00zxgt,2026-01-25T09:06:09.619Z,"A ranar Juma'ar da ta gabata, kafofin yaɗa labarai na cikin gida ne aka bai wa damar shiga zaman kwamitin a birnin Dar es Salaam.",media_and_online,news_reporting,public_interest,,safe,true,,Collected from BBC Hausa
71a668d8-57cd-42be-a119-5e52e45c2558,hausa,latin,Nigeria,standard_hausa,media,https://www.bbc.com/hausa/live/c368rn00zxgt,2026-01-25T09:06:09.620Z,"Wata sanarwa da wata jarida mai zaman kanta 'The Citizen' ta wallafa a shafukan sada zumunta ta ce an ba wa ƴan jarida damar yaɗa labaran zaman da aka yi ranar Juma’a, inda waɗanda abin ya shafa suka bayyana yadda al'amura suka gudana lokacin rikicin.",media_and_online,news_reporting,public_interest,,safe,true,,Collected from BBC Hausa
76ac80c8-c88a-46ef-8c81-de68d634dd6a,hausa,latin,Nigeria,standard_hausa,media,https://www.bbc.com/hausa/live/c368rn00zxgt,2026-01-25T09:06:09.621Z,Har yanzu ba a tabbatar da ko za a mai do da damar kafofin watsa labarai na shiga zama na gaba ba.,media_and_online,news_reporting,public_interest,,safe,true,,Collected from BBC Hausa
51e2a5ec-d659-4db5-ba6d-fc36d705d156,hausa,latin,Nigeria,standard_hausa,media,https://www.bbc.com/hausa/live/c368rn00zxgt,2026-01-25T09:06:09.621Z,Wata kafar yaɗa labaran Iran ta rawaito cewa gwamnatin ƙasar dawo da intanet din data ɗauke a sassan ƙasar.,media_and_online,news_reporting,public_interest,,safe,true,,Collected from BBC Hausa
d9a686cb-2f4f-4180-87ac-873f862fde2e,hausa,latin,Nigeria,standard_hausa,media,https://www.bbc.com/hausa/live/c368rn00zxgt,2026-01-25T09:06:09.622Z,Gwamnatin ta katse intanet ɗin ne a lokacin da aka fara zanga zangar nuna adawa da matakan gwamnati a faɗin ƙasar a ƙarshen watan da ya gabata.,media_and_online,news_reporting,public_interest,,safe,true,,Collected from BBC Hausa
e1051e9d-4161-4d37-b524-bea18e1d230d,hausa,latin,Nigeria,standard_hausa,media,https://www.bbc.com/hausa/live/c368rn00zxgt,2026-01-25T09:06:09.623Z,Jami'ai sun ce za a ɗauki tsawon lokaci kafin duka harkokin Intanet su daidai ta saboda wasu matsaloli na na'ura.,media_and_online,news_reporting,public_interest,,safe,true,,Collected from BBC Hausa
b0f41d90-9529-403e-a799-81a336a1f751,hausa,latin,Nigeria,standard_hausa,media,https://www.bbc.com/hausa/live/c368rn00zxgt,2026-01-25T09:06:09.624Z,Ɗaukewar intanet ɗin ya sa an gaza tabbatar da adadin mutanen da aka kashe a lokacin zanga zangar.,media_and_online,news_reporting,public_interest,,safe,true,,Collected from BBC Hausa
0475a0ab-0978-427f-a81a-102b0ce03e1a,hausa,latin,Nigeria,standard_hausa,media,https://www.bbc.com/hausa/live/c368rn00zxgt,2026-01-25T09:06:09.624Z,Wata ƙungiyar kare haƙƙin ɗan'adam da ke Amurka ta ce an kashe fiye da mutane dubu huɗu.,media_and_online,news_reporting,public_interest,,safe,true,,Collected from BBC Hausa
a5fabe6e-c4c6-4c0a-9046-719b1e2dc053,hausa,latin,Nigeria,standard_hausa,media,https://www.bbc.com/hausa/live/c368rn00zxgt,2026-01-25T09:06:09.625Z,Jami’an tsaro na gwamnatin tarayya a Amurka sun bindige wani mutum mai zanga-zanga a birnin Minneapolis ranar Asabar.,media_and_online,news_reporting,public_interest,,safe,true,,Collected from BBC Hausa
3a06c550-8865-49c5-b2c9-88b717b60256,hausa,latin,Nigeria,standard_hausa,media,https://www.bbc.com/hausa/live/c368rn00zxgt,2026-01-25T09:06:09.626Z,Wannan dai shi ne mutum na biyu da aka kashe a birnin tun lokacin da gwamnatin Trump ta ƙaddamar da wani yaƙi na musammman kan ƴan cirani a jihar ta Minnesota.,media_and_online,news_reporting,public_interest,,safe,true,,Collected from BBC Hausa
b7e81ed6-5ccc-43e0-ade4-d410066bc8c5,hausa,latin,Nigeria,standard_hausa,media,https://www.bbc.com/hausa/live/c368rn00zxgt,2026-01-25T09:06:09.627Z,"Jami’an yankin sun bayyana sunan mutumin a matsayin Alex Pretti mai shekaru 37, ɗan ƙasar Amurka ne kuma ma'aikacin jinya da ke zaune a Minneapolis.",media_and_online,news_reporting,public_interest,,safe,true,,Collected from BBC Hausa
ef03a735-8384-4f77-b286-b86be7b168f8,hausa,latin,Nigeria,standard_hausa,media,https://www.bbc.com/hausa/live/c368rn00zxgt,2026-01-25T09:06:09.627Z,Bidiyo da aka wallafa a shafukan intanet sun nuna yadda aka yi taho-mu-gama tsakanin jami'an tsaron kan iyaka da kuma mutumin.,media_and_online,news_reporting,public_interest,,safe,true,,Collected from BBC Hausa
4bfc8f8c-c57d-409e-9a36-d258aa115e2c,hausa,latin,Nigeria,standard_hausa,media,https://www.bbc.com/hausa/live/c368rn00zxgt,2026-01-25T09:06:09.628Z,"Ma’aikatar tsaron cikin gida (DHS) ta ce jami’an sun yi harbi ne domin kariyar kai bayan Pretti, wanda suka ce yana da riƙe da bindiga, ya bijirewa yunƙurinsu na ƙwace masa makamai.",media_and_online,news_reporting,public_interest,,safe,true,,Collected from BBC Hausa
179500f7-7a44-47ae-ab75-043e7493a84e,hausa,latin,Nigeria,standard_hausa,media,https://www.bbc.com/hausa/live/c368rn00zxgt,2026-01-25T09:06:09.629Z,"Lamarin, wanda ya zo makonni biyu bayan harbe Renee Nicole Good da wani jami’in shige-da-fice ya yi, ya haifar da ci gaban zanga-zanga tare da kiraye kiraye da shugabannin yankin cewa jami'an tsaron gwamnatin tarayya su fice daga birnin.",media_and_online,news_reporting,public_interest,,safe,true,,Collected from BBC Hausa
b707ec87-8fdf-4bd9-8992-95749b4541c4,hausa,latin,Nigeria,standard_hausa,media,https://www.bbc.com/hausa/live/c368rn00zxgt,2026-01-25T09:06:09.630Z,Masu bibiyar shafin BBC Hausa kai-tsaye barkanmu da safiyar wannan rana ta Lahadi.,media_and_online,news_reporting,public_interest,,safe,true,,Collected from BBC Hausa
b8322ffe-b426-40da-aeef-730f70e24337,hausa,latin,Nigeria,standard_hausa,media,https://www.bbc.com/hausa/live/c368rn00zxgt,2026-01-25T09:06:09.630Z,"Kamar kullum, yau ma za mu kawo muku abubuwan da ke faruwa a Najeriya da sauran sassan duniya.",media_and_online,news_reporting,public_interest,,safe,true,,Collected from BBC Hausa
4614988a-6578-491b-b881-4bec9949dc61,hausa,latin,Nigeria,standard_hausa,media,https://www.bbc.com/hausa/live/c368rn00zxgt,2026-01-25T09:06:09.631Z,"Za ku iya leƙawa shafukan sada zumuntanmu na intanet, da facebook da X da kuma whatsapp domin karanta sauran labarai da kallon bidiyo da tafka muhawara kan labaran da mu ke wallafawa.",media_and_online,news_reporting,public_interest,,safe,true,,Collected from BBC Hausa
199937fc-add2-4639-819a-6c4a370f5b87,hausa,latin,Nigeria,standard_hausa,media,https://www.bbc.com/hausa/articles/c2lgrqxylzjo,2026-01-25T09:06:10.304Z,"Tottenham da Liverpool na tattaunawa kan yarjejeniyar fam miliyan 5 game da kaftin din Scotland Andy Robertson, 31.",media_and_online,news_reporting,public_interest,,safe,true,,Collected from BBC Hausa
a08fbe08-bc97-4fd3-8316-3ad6dab85989,hausa,latin,Nigeria,standard_hausa,media,https://www.bbc.com/hausa/articles/c2lgrqxylzjo,2026-01-25T09:06:10.305Z,A daya ɓangaren kuma Liverpool ta sabunta buƙatar da take yi wa ɗanwasan baya na Fulham da Amurka mai shekara 28 Antonee Robinson.,media_and_online,news_reporting,public_interest,,safe,true,,Collected from BBC Hausa
5699b74d-b515-43e2-a283-d20406792339,hausa,latin,Nigeria,standard_hausa,media,https://www.bbc.com/hausa/articles/c2lgrqxylzjo,2026-01-25T09:06:10.306Z,"Bournemouth na dab da kammala yarjejeniya kan karɓo aron golan Lazio da Girka Christos Mandas, mai shekara 24.",media_and_online,news_reporting,public_interest,,safe,true,,Collected from BBC Hausa
eff7409b-2eb8-4e97-8aff-07634524e8e7,hausa,latin,Nigeria,standard_hausa,media,https://www.bbc.com/hausa/articles/c2lgrqxylzjo,2026-01-25T09:06:10.307Z,"Arsenal sai ta lale fam miliyan 80 kafin ɗauko ɗanwasan gaba na Atletico Madrid da Argentina Julian Alvarez, mai shekara 25.",media_and_online,news_reporting,public_interest,,safe,true,,Collected from BBC Hausa
a4a5b253-ed83-4092-8d85-1074c65ff026,hausa,latin,Nigeria,standard_hausa,media,https://www.bbc.com/hausa/articles/c2lgrqxylzjo,2026-01-25T09:06:10.307Z,"Sunderland ta tuntuɓi Borussia Monchengladbach game da golan Switzerland Jonas Omlin, mai shekara 32.",media_and_online,news_reporting,public_interest,,safe,true,,Collected from BBC Hausa
e3cee4fc-6c10-4be2-89b5-c7611fa9dcea,hausa,latin,Nigeria,standard_hausa,media,https://www.bbc.com/hausa/articles/c2lgrqxylzjo,2026-01-25T09:06:10.308Z,"Ɗanwasan baya na Ukraine Oleksandr Zinchenko, mai shekara 29, na ci gaba da tattaunawa da Arsenal kan batun zama ɗanwasan Ajax maimakon aro.",media_and_online,news_reporting,public_interest,,safe,true,,Collected from BBC Hausa
9774e98d-eefe-40ba-b57a-f90a7c55135c,hausa,latin,Nigeria,standard_hausa,media,https://www.bbc.com/hausa/articles/c2lgrqxylzjo,2026-01-25T09:06:10.309Z,Crystal Palace na neman wanda zai maye gurbin Marc Guehi da ya koma taka leda a Manchester City.,media_and_online,news_reporting,public_interest,,safe,true,,Collected from BBC Hausa
30c8f884-6cd8-4820-8752-6d5685150e5b,hausa,latin,Nigeria,standard_hausa,media,https://www.bbc.com/hausa/articles/cx2le5j6429o,2026-01-25T09:06:11.146Z,"Bayan da tankiya ta ɓarke tsakanin Washington da Tehran sakamakon ƙazamin murkushe masu zanga-zanga da gwamnatin Iran ta yi, Saudi Arabia da Qatar da Oman, sun ƙaddamar da wani gagarumin yunƙuri na hana shugaban Amurka Donald Trump kai wa Iran hari, saboda fargabar cewa irin wannan matakin zai haifar da ""mummunan martani a yankin"", kamar yadda wani babban jami'in Saudiyya ya shaida wa AFP.",media_and_online,news_reporting,public_interest,,safe,true,,Collected from BBC Hausa
d09feee5-0d95-47df-97fd-b50104fc349a,hausa,latin,Nigeria,standard_hausa,media,https://www.bbc.com/hausa/articles/cx2le5j6429o,2026-01-25T09:06:11.147Z,"Jami'in na Saudiyya ya ce ƙasashen yankin Gulf guda uku sun gudanar da ƙasurgumin aikin diflomasiyya domin shawo kan shugaban Amurka ya bai wa shugabannin Iran damar nuna nadama, kuma har yanzu hanyoyin sadarwa a buɗe suke domin ƙarfafa amincewar juna.",media_and_online,news_reporting,public_interest,,safe,true,,Collected from BBC Hausa
586e934d-a243-4c92-8ca4-8e3ab6f5d23d,hausa,latin,Nigeria,standard_hausa,media,https://www.bbc.com/hausa/articles/cx2le5j6429o,2026-01-25T09:06:11.147Z,"Yaya ƙasashen yankin Gulf na Farisa ke kallon ""makwabciyarsu da ek fama da rashin kwanciyar hankali"" kuma menene damuwarsu kan halin da ta ke ciki?",media_and_online,news_reporting,public_interest,,safe,true,,Collected from BBC Hausa
9576d789-ea64-4264-a43c-fc719ff4fff8,hausa,latin,Nigeria,standard_hausa,media,https://www.bbc.com/hausa/articles/cx2le5j6429o,2026-01-25T09:06:11.148Z,"Yiwuwar ɗaukar matakin soji na Amurka kan Iran ya kasance wani muhimmin batu da ke matuƙar kawo damuwa a ayyukan diflomasiyyan ƙasashen larabawa, musamman tsakanin kasashen da ke ƙungiyar ƙasashen yankin Gulf.",media_and_online,news_reporting,public_interest,,safe,true,,Collected from BBC Hausa
d9390c00-fbf7-4d53-8c59-e105c2cc9e80,hausa,latin,Nigeria,standard_hausa,media,https://www.bbc.com/hausa/articles/cx2le5j6429o,2026-01-25T09:06:11.150Z,"Wannan damuwar ta samo asali ne daga kusancin da suke da ƙasar Iran, wanda duk da kasancewarta makwabciya ƙasashen yankin Tekun Fasha, dangantaka tsakaninsu ta na tangal-tangal tsakanin takun saƙa zuwa samun cikakkiyar fahimta zauwa yankewar zamantakewa baki ɗaya.",media_and_online,news_reporting,public_interest,,safe,true,,Collected from BBC Hausa
62845f23-8ee5-457a-a925-c95c143a0deb,hausa,latin,Nigeria,standard_hausa,media,https://www.bbc.com/hausa/articles/cx2le5j6429o,2026-01-25T09:06:11.151Z,"Sai dai kuma, sake dawo da hulɗa tsakanin Saudiyya da Iran tare da shiga tsakani na ƙasar China a shekarar 2023, wani lokaci ne da ya kafa dangantakar a kan sabbin ginshiki, ciki har da mutunta ƙa'idar rashin tsoma baki a cikin harkokin cikin gidan juna, don samar da yanayin diflomasiyya na kwanciyar hankali.",media_and_online,news_reporting,public_interest,,safe,true,,Collected from BBC Hausa
523251ca-d64e-45de-ac4c-93472bf4527e,hausa,latin,Nigeria,standard_hausa,media,https://www.bbc.com/hausa/articles/cx2le5j6429o,2026-01-25T09:06:11.152Z,"A cikin wannan yanayi, wasu manyan biranen yankin Gulf sun ƙulla hulɗar diflomasiyya da ɓangarori daban-daban don hana ɓarkewar rikici kan Iran, wanda zai iya haifar da sauyin gwamnati.",media_and_online,news_reporting,public_interest,,safe,true,,Collected from BBC Hausa
21855f1e-2e22-410a-acb3-4f4298f0a757,hausa,latin,Nigeria,standard_hausa,media,https://www.bbc.com/hausa/articles/cx2le5j6429o,2026-01-25T09:06:11.153Z,"Ƙasashen yankin tekun Fasha na da gagarumin ƙarfin tattalin arziki da kuma zuba jari mai yawa a ƙasar Amurka, yayin da a sa'i daya kuma suna daidaita hulɗar da ke tsakaninsu da sauran manyan ƙasashen duniya ciki har da ƙasar China.",media_and_online,news_reporting,public_interest,,safe,true,,Collected from BBC Hausa
e9e7aa5f-bb43-4d86-b4e9-d7cf5d0de1f1,hausa,latin,Nigeria,standard_hausa,media,https://www.bbc.com/hausa/articles/cx2le5j6429o,2026-01-25T09:06:11.154Z,"Wannan kayan aiki ya ba su damar da ba a taɓa ganin irinta ba wajen tafiyar da husuma da kuma yin matsin lamba kan ɓangarori daban-daban da nufin hana ɓarkewar tashin hankalin soji a Iran, kuma mafi mahimmanci, tabbatar da cewa yankin Gulf ya kasance cikin ƴanci daga duk wani rikici.",media_and_online,news_reporting,public_interest,,safe,true,,Collected from BBC Hausa
ce630ff9-c97c-4eec-b526-2a9a4789db22,hausa,latin,Nigeria,standard_hausa,media,https://www.bbc.com/hausa/articles/cx2le5j6429o,2026-01-25T09:06:11.156Z,"Ahmed Shizawi, marubuci kuma mai sharhi kan harkokin siyasar Oman, ya yi imanin cewa, ƙasashen yankin Gulf na da ingantattaccen tsarin diflomasiyya da za su iya yin matsin lamba daga kowane ɓangare, ta hanyar sadarwa kai tsaye a lokutan tashin hankali ko kuma ta hanyar shiga tsakani, kamar abin da Oman ke yi da Iran.",media_and_online,news_reporting,public_interest,,safe,true,,Collected from BBC Hausa
40910506-19ca-4819-85fb-c1a82b0ee80a,hausa,latin,Nigeria,standard_hausa,media,https://www.bbc.com/hausa/articles/cx2le5j6429o,2026-01-25T09:06:11.156Z,Yanzu za ku iya samun labaran BBC Hausa kai-tsaye a wayoyinku.,media_and_online,news_reporting,public_interest,,safe,true,,Collected from BBC Hausa
c8708612-cf0c-43e7-bcf9-16778d5658f5,hausa,latin,Nigeria,standard_hausa,media,https://www.bbc.com/hausa/articles/cx2le5j6429o,2026-01-25T09:06:11.157Z,"A cikin shekaru 20 da suka gabata, ƙasashen yankin Gulf sun yi ƙoƙarin inganta tattalin arzikinsu a maimakon da dogaro da man fetur da kuma mayar da hankali kan ɓangarori daban-daban kamar ayyukan gidaje, yawon buɗe ido da fasaha da kiwon lafiya, da zuba jari.",media_and_online,news_reporting,public_interest,,safe,true,,Collected from BBC Hausa
38d34971-0223-47af-9f57-d929742fb1fb,hausa,latin,Nigeria,standard_hausa,media,https://www.bbc.com/hausa/articles/cx2le5j6429o,2026-01-25T09:06:11.158Z,Sun kuma nemi ƙarfafa matsayinsu a tarukan duniya da cibiyoyin yanke shawara ta hanyar taka rawar shiga tsakani a lamuran kasa da kasa maus sarƙaƙiya.,media_and_online,news_reporting,public_interest,,safe,true,,Collected from BBC Hausa
51f3b48d-8bea-4d95-a724-12f310f247c0,hausa,latin,Nigeria,standard_hausa,media,https://www.bbc.com/hausa/articles/cx2le5j6429o,2026-01-25T09:06:11.159Z,"To sai dai kuma a na su ɓangaren, har yanzu wannan yunƙurin na dauke da sharaɗin tabbatar da zaman lafiya a yankin, wanda duk wani hari da Amurka za ta iya kai wa Iran zai yi matuƙar tasiri.",media_and_online,news_reporting,public_interest,,safe,true,,Collected from BBC Hausa
3924bb8d-f4d2-496c-bd68-816f4ddbc4a2,hausa,latin,Nigeria,standard_hausa,media,https://www.bbc.com/hausa/articles/cx2le5j6429o,2026-01-25T09:06:11.160Z,"Ahmed Shizawi, marubucim dan ƙasar Oman kuma manazarcin siyasa ya yi imanin cewa, ƙasashen yankin Gulf na fuskantar babban koma-baya dangane da yadda tashe-tashen hankula ke ƙara ƙamari a baya-bayan nan tsakanin Washington da Teheran, kuma suna kallon matakin na diflomasiyya a matsayin wani yunƙuri na tabbatar da tsaronsu a yankin da ka iya ganin taɓarɓrewar al'amura da ke barazana ga zaman lafiyarsu.",media_and_online,news_reporting,public_interest,,safe,true,,Collected from BBC Hausa
2eb655d4-70fe-4fd1-86f1-c19017efad26,hausa,latin,Nigeria,standard_hausa,media,https://www.bbc.com/hausa/articles/cx2le5j6429o,2026-01-25T09:06:11.161Z,"Yana mai cewa: ""Don kiyaye zaman lafiya da tattalin arzikinsu da kuma hana ƙasashensu zama fagen daga a rikice-rikice tsakanin ƙasashen ketare, kodayaushe suna karkata zuwa ga tsarin diflomasiyya, da nufin jawo gwamnatin Amurka kan tafarkin diflomasiyya maimakon ɗaukar matakin soja.",media_and_online,news_reporting,public_interest,,safe,true,,Collected from BBC Hausa
4d4e0333-3243-44ca-92a9-e88283d5948c,hausa,latin,Nigeria,standard_hausa,media,https://www.bbc.com/hausa/articles/cx2le5j6429o,2026-01-25T09:06:11.162Z,"Suna ci gaba da ƙulla ƙawance da Amurka, kuma a lokaci guda suna hulɗa da babbar makwabciyarsu kamar Iran.",media_and_online,news_reporting,public_interest,,safe,true,,Collected from BBC Hausa
97a07bb9-5fff-4737-8cc4-55802278f1b1,hausa,latin,Nigeria,standard_hausa,media,https://www.bbc.com/hausa/articles/cx2le5j6429o,2026-01-25T09:06:11.163Z,"Samar da daidaito tsakanin ƙawance da Washington da hulɗa da Tehran, ya kasance babban ƙalubale ga ƙungiyar haɗin gwiwar ƙasashen yankin Gulf.""",media_and_online,news_reporting,public_interest,,safe,true,,Collected from BBC Hausa
c1d81478-75cf-47a1-b14e-63386224c9e5,hausa,latin,Nigeria,standard_hausa,media,https://www.bbc.com/hausa/articles/cx2le5j6429o,2026-01-25T09:06:11.164Z,"Ana nuna matuƙar shakku da damuwa kan yiwuwar rugujewar gwamnatin Iran a waɗannan ƙasashe, saboda ana fargabar hakan zai iya haifar da ɓullar mayaƙan sa-kai masu adawa da juna ko kuma bullowar ƙungiyoyi masu iƙirarin ballewa a cikin kasar.",media_and_online,news_reporting,public_interest,,safe,true,,Collected from BBC Hausa
ed351719-2f7f-40da-95d6-3d3e093a8a73,hausa,latin,Nigeria,standard_hausa,media,https://www.bbc.com/hausa/articles/cx2le5j6429o,2026-01-25T09:06:11.165Z,"A cewar wasu majiyoyin da suka zanta da BBC, irin wannan lamari na iya haifar da ruɗani na tsaro, sakamakon cewa ba zai tsaya ga Iran kaɗai ba, zai iya yaɗuwa zuwa ƙasashen yankin Gulf.",media_and_online,news_reporting,public_interest,,safe,true,,Collected from BBC Hausa
86e28bea-f7aa-4741-8f00-e78c8e82ced8,hausa,latin,Nigeria,standard_hausa,media,https://www.bbc.com/hausa/articles/cx2le5j6429o,2026-01-25T09:06:11.165Z,"Bugu da ƙari, suna nuna damuwa cewa ɗora gwamnatin da Amurka da Isra'ila ke marawa baya zai ƙara tasirin Isra'ila a cikin Iran.",media_and_online,news_reporting,public_interest,,safe,true,,Collected from BBC Hausa
