language,script,country,region_dialect,source_type,source_ref,collection_date,text,domain,topic,theme,sensitive_characteristic,safety_flag,pii_removed
hausa,latin,Nigeria,Standard,web_public,https://twitter.com/RasheederhB/status/2016495355638997164,2026-01-28,"Ya Allah ka aurar damu zuwa ga mazaje nagari",culture_and_religion,prayer,public_interest,,safe,true
hausa,latin,Nigeria,Standard,web_public,https://twitter.com/bnsanifta/status/2016238952152273119,2026-01-27,"[USER] Tofa, ga mazaje fa",culture_and_religion,Calling for attention,public_interest,,safe,true
hausa,latin,Nigeria,Standard,web_public,https://twitter.com/GenBamaiyi/status/2016085662437429748,2026-01-27,"Aure ba na yara ba ne! Sai Mazaje.",culture_and_religion,Marriage without children,stereotypes,age,sensitive,true
hausa,latin,Nigeria,Standard,web_public,https://twitter.com/safiyyabiso/status/2015905136879473114,2026-01-26,"Mazaje Don Allah ku riqa riqe Aure da kyau, wallahi Ana kashe kudi a kitchen sosai.",culture_and_religion,Marriage customs,public_interest,,safe,true
hausa,latin,Nigeria,Standard,web_public,https://twitter.com/AliyuJAliyu2/status/2015574609739813241,2026-01-25,"KHALIFA BABA ALI Hakika Ka Cika Gwarzon Shugaba Namiji Uban Mazaje Allah Ya Kara Lapiya Da Nisan Kwana Allah Ya Kara Karfafa Ku Da Himmar ABULFATHI R.T.A. Hakika Kun Damu Da Damuwar Ahlullahi Muna Muku Jinjina Da Fatan Akan Alkairi [URL]",culture_and_religion,Religious message,public_interest,,safe,true
hausa,latin,Nigeria,Standard,web_public,https://twitter.com/RakaFatima/status/2015435756601327851,2026-01-25,"KHALIFA BABA ALI Hakika Ka Cika Gwarzon Shugaba Namiji Uban Mazaje Allah Ya Kara Lapiya Da Nisan Kwana Allah Ya Kara Karfafa Ku Da Himmar ABULFATHI R.T.A. Hakika Kun Damu Da Damuwar Ahlullahi Muna Muku Jinjina Da Fatan Akan Alkairi [URL]",culture_and_religion,Religious appeal,public_interest,,safe,true
hausa,latin,Nigeria,Standard,web_public,https://twitter.com/rahmerh_leeu/status/2014837698427568293,2026-01-23,"[USER] [USER] MashaAllah Allah ya nuna man auren ku Ya Baku mazaje nagari masu sonku kamar zasu mutu",culture_and_religion,Marriage,public_interest,religion,sensitive,true
hausa,latin,Nigeria,Kano,web_public,https://twitter.com/akabir494/status/2014721756318126320,2026-01-23,"[USER] Kungiyar mazaje na nigeria suna allah wadai f wanan kalamai naka dakayi asarar su, bamu yafe ba",culture_and_religion,criticism of speech,hate_or_insult,tribe,sensitive,true
hausa,latin,Nigeria,Kano,web_public,https://twitter.com/itsadamzaby1010/status/2014627055183290602,2026-01-23,"[USER] Na jima da gane mazaje da yawa MAULA da KWARAM ne ke kai su wajen ƴanmata. Sai yasa kuke karewa cikin korafe-korafe",culture_and_religion,sexual exploitation,stereotypes,gender,sensitive,true
hausa,latin,Nigeria,Standard,web_public,https://twitter.com/RakaFatima/status/2014441774744277372,2026-01-22,"Mazaje na amsa sunan hadiman Annabi ﷺ a koda yaushe ni Ibrahim ina tsere dasu cikin hidimar Annabi ﷺ inma na mutu ya'yana zasu cigaba da tsere da gasa dasu cikin Hadimar Annabi ﷺ Shehu da ya'yansa basu da aiki se hidimar Annabi ﷺ shiyasa muke ƙaunar su muka riƙe su jagorori [URL]",culture_and_religion,Devotion to Prophet,public_interest,,safe,true
hausa,latin,Nigeria,Standard,web_public,https://twitter.com/Al_Tangazee/status/2016688254863442031,2026-01-29,"[USER] Happy uwar marayu, Allah ya qara arziki da Wadata",culture_and_religion,Blessing and good wishes,public_interest,,safe,true
hausa,latin,Nigeria,Kano,web_public,https://twitter.com/Mustaphajibia/status/2016650824517095915,2026-01-28,"[USER] Sai maigida Allah ya qara arziki da daukaka da nisan kwana M.A.JIBIA",culture_and_religion,Blessing and prosperity,public_interest,,safe,true
hausa,latin,Nigeria,Kano,web_public,https://twitter.com/Kamalbkd/status/2016648635102998622,2026-01-28,"Baka da bakin Uwa Mal. [USER] shiyasa kullum lamuranka ke gaba! Allah kara kareka, lafiya, arziki da nisan kwana mai amfani. [URL]",culture_and_religion,Blessing and well-wishes,public_interest,,safe,true
hausa,latin,Nigeria,Standard,web_public,https://twitter.com/ibrahimgwas/status/2016528044903604557,2026-01-28,"My mentor sir sulaiman maji jamo uban gidan arziki [URL]",livelihoods_and_work,mentor and wealth,public_interest,,safe,true
hausa,latin,Nigeria,Standard,web_public,https://twitter.com/AbubakarLa26557/status/2016517645277773839,2026-01-28,"[USER] Allah ya kara arziki",culture_and_religion,religious blessing,public_interest,,safe,true
hausa,latin,Nigeria,Standard,web_public,https://twitter.com/___Abdulsalam/status/2016511986222149964,2026-01-28,"[USER] [USER] Allah yayi mana arziki",culture_and_religion,religious blessing,public_interest,,safe,true
hausa,latin,Nigeria,Standard,web_public,https://twitter.com/M2quare_/status/2016491867085455697,2026-01-28,"[USER] [USER] Shi arziki na Allah ne, idan mutum yasamu Allah ya bashi sannan idan mutum ya na nema toh yanema a gurin Allah zai bashi don Allah baya hana bayinsa, ni witness ne Shiyasa nima straight a gurin Allah name nema ya bani.",culture_and_religion,Blessings and seeking Allah's help,public_interest,,safe,true
hausa,latin,Nigeria,Standard,web_public,https://twitter.com/grok/status/2016476603367268391,2026-01-28,"[USER] [USER] Omoshalewa sunan Yoruba ne, yana nufin ""yaro ya zaɓi wannan gida don ya zo"" ko ""yaro ya kawo albarka da arziki"". Idan ba haka ba, ka bayyana abin da kake nufi!",culture_and_religion,Yoruba name meaning,public_interest,,safe,true
hausa,latin,Nigeria,Standard,web_public,https://twitter.com/binjabar10/status/2016451432539377894,2026-01-28,"[USER] Dattijon arziki",livelihoods_and_work,wealth and prosperity,public_interest,,safe,true
hausa,latin,Nigeria,Standard,web_public,https://twitter.com/trtafrikaHA/status/2016443040051736677,2026-01-28,"Shugaba Erdogan da Shugaba Tinubu sun jagoranci sanya hannu kan yarjeniyoyi tara a yayin da Ankara ke da manufar ƙulla kasuwancin dala biliyan 5 da ƙasa mafi ƙarfin tattalin arziki a Afirka. [URL]",governance_civic,Political leaders meeting,public_interest,,safe,true
hausa,latin,Nigeria,Standard,web_public,https://twitter.com/ABBAWEB3/status/2016440255759409649,2026-01-28,"Jiki na son barci Hankali na son kuɗi Zuciya na son ƙauna Rai na buƙatar Allah Ya Allah, Ka ba mu nutsuwa a jiki, Ka albarkaci hankalinmu da halal arziki, Ka cika zukatanmu da ƙauna ta gaskiya, kuma Ka ƙarfafa rayukanmu da kusancinka. Ameen ya hayyu ya qayyum D A [URL]",culture_and_religion,prayer and supplication,public_interest,,safe,true
hausa,latin,Nigeria,Standard,web_public,https://twitter.com/AbbaJohn120576/status/2016414441009553852,2026-01-28,"[USER] Ubangiji Allah yakara lapiya da arziki Ameen",culture_and_religion,blessing and prosperity,public_interest,,safe,true
hausa,latin,Nigeria,Standard,web_public,https://twitter.com/UsamaUsman16898/status/2016410131085279466,2026-01-28,"Akwai abukan arziki ba amma basu da kuɗi amma akwai zaman lafiya, Allah ka azirta mu da masu sunmu da Allah, da wanda zai tai maka mu, [URL]",livelihoods_and_work,wealth and peace,public_interest,,safe,true
hausa,latin,Nigeria,Standard,web_public,https://twitter.com/its_tataboo/status/2016404078603936234,2026-01-28,"Akwai Kuɗi, akwai Wadata, akwai wadatar zuci, akwai arziki, akwai kuma dukiya, akwai rufin asiri duk ma'anar su daban [URL]",livelihoods_and_work,Wealth and prosperity,public_interest,,safe,true
hausa,latin,Nigeria,Standard,web_public,https://twitter.com/miftahuJikaDala/status/2016397990924083620,2026-01-28,"Babu Wani Arziki Daya Kai, Ka Wayi Gari Musulmi Zuciyarka Cike Da Soyayyar MANZON ALLAH ﷺ [URL]",culture_and_religion,Islamic faith and devotion,public_interest,religion,sensitive,true
hausa,latin,Nigeria,Standard,web_public,https://twitter.com/Ibrhm1410203008/status/2016385851849146732,2026-01-28,"[USER] Gaskiya ne, duk abunda ya fada hakane da haka Fara wlh,muna tare dashi. Allah ya Qara Arziki me Albarka",culture_and_religion,Blessing and praise,public_interest,,safe,true
hausa,latin,Nigeria,Standard,web_public,https://twitter.com/cutelittlewolff/status/2016315264493646273,2026-01-28,"Ina kaunar gidan hadi sam balaraba batayi gadon arziki ba",livelihoods_and_work,Wealth and money,public_interest,,safe,true
hausa,latin,Nigeria,Standard,web_public,https://twitter.com/khadeejah_MI/status/2016293102051287437,2026-01-27,"[USER] Allah ka bani arziki na siya Mercedes",livelihoods_and_work,Seeking wealth and status,public_interest,,safe,true
hausa,latin,Nigeria,Standard,web_public,https://twitter.com/bmjvermerlleey/status/2016212060896440745,2026-01-27,"Yaa Allah, ina roƙonKa da duk wanda ya ga wannan form na kujerar aikin Hajjin 2026, ALLAH Ka azurta shi da samun damar zuwa Hajji, tare da Iyayansa da ‘yan uwansa. Ka buɗe masu ƙofofin arziki na halal, Ka yalwata masu, Ka kuma sanya alheri da albarka a rayuwarsu. [URL]",culture_and_religion,Prayer for Hajj success,public_interest,,safe,true
hausa,latin,Nigeria,Standard,web_public,https://twitter.com/BornoYoung/status/2016200466472845753,2026-01-27,"Assalamu allaikum jama'ar arziki. Ina muku fatan alheri [URL]",culture_and_religion,religious greeting,public_interest,,safe,true
hausa,latin,Nigeria,Standard,web_public,https://twitter.com/fatyma_BintMuhd/status/2016187758360801654,2026-01-27,"Kuzo kusai abin Arziki [URL]",livelihoods_and_work,Wealth and prosperity,public_interest,,safe,true
hausa,latin,Nigeria,Standard,web_public,https://twitter.com/ismaeeelrabiu3/status/2016186916811452835,2026-01-27,"Bayan lafiya, ba nisan wani arziki a duniya ba sama da wadatar zuciya. Dan adam akwai hadama, amma wanda suka rabu da wadatar zuciya sun huta da hauma haumar wannan duniyar mai cike da rudani da zato. Allah ya sa mu gama lafiya",culture_and_religion,spirituality and well-being,public_interest,,safe,true
hausa,latin,Nigeria,Standard,web_public,https://twitter.com/Usouph/status/2016183134488859119,2026-01-27,"[USER] Oga Sir kai de mu dage da addua Allah ya mana arziki Ameeen",culture_and_religion,Prayer for Wealth,public_interest,,safe,true
hausa,latin,Nigeria,Standard,web_public,https://twitter.com/ASHIRUTUKUR17/status/2016181596739489937,2026-01-27,"[USER] [USER] [USER] [USER] [USER] Na arziki ba",livelihoods_and_work,personal financial status,public_interest,,safe,true
hausa,latin,Nigeria,Standard,web_public,https://twitter.com/LadyBebah/status/2016172733734760938,2026-01-27,"[USER] [USER] Amin ya Rabbi Allah ya Kara Arziki",culture_and_religion,Islamic prayer,public_interest,,safe,true
hausa,latin,Nigeria,Standard,web_public,https://twitter.com/SalimTech169965/status/2016162584718619083,2026-01-27,"Market Education Why does news move the market? Big institutions trade based on economic data. Retail traders react after. Stay informed. Trade smart Ilimin Kasuwa Me yasa labarai ke motsa kasuwa? Manyan kamfanoni suna ciniki ne bisa bayanan tattalin arziki #ForexNews [URL]",livelihoods_and_work,Market and news,public_interest,,safe,true
hausa,latin,Nigeria,Bauchi,web_public,https://twitter.com/DaudaGeo85353/status/2016147162522935492,2026-01-27,"Wata Rana acikin garin Alkaleri yayinda maigirma kwamishinan Ma'adanai na Jihar Bauchi, Hon. Muhammad Maiwada Bello Geo Barrister (Sadaukin Alkaleri) ya shigo tareda tawagan sa domin gaishe-gaishe wa Iyaye, 'yan uwa da abokan arziki. [URL]",governance_civic,Governmental visit,public_interest,,safe,true
hausa,latin,Nigeria,Standard,web_public,https://twitter.com/RealNaTajjulizz/status/2016146294582993258,2026-01-27,"[USER] Kaman tanada gaskiya Amma arziki da talauci duk na Allah ne",culture_and_religion,religion and wealth,public_interest,,safe,true
hausa,latin,Nigeria,Kano,web_public,https://twitter.com/ASHIRUTUKUR17/status/2016141687559471335,2026-01-27,"[USER] To dama waya gaya maku comrade yana abun arziki da abunda zai barki kenan mugayen kalaman turanci wata fah har sai ta je tayi bincike kan one word da comrade ya gaya mata saboda wahalar sha’ani",media_and_online,Discussing a word or phrase,misinformation,language,sensitive,true
hausa,latin,Nigeria,Kano,web_public,https://twitter.com/Usouph/status/2016132350376063063,2026-01-27,"Wato idan kana da kudi ko, zagi ma dariya zai baka Na dan jima da gane cewa masu kudi ba komai ke bata masu rai ba. Allah ka mana arziki Ameeen",culture_and_religion,Wealth and Status,stereotypes,wealth,sensitive,true
hausa,latin,Nigeria,Standard,web_public,https://twitter.com/callmeamir113/status/2016125273196925180,2026-01-27,"[USER] Allah ya qara Arziki Mai Albarka",culture_and_religion,religious blessing,public_interest,,safe,true
hausa,latin,Nigeria,Standard,web_public,https://twitter.com/_Big__brother/status/2016122705184018805,2026-01-27,"Yawan dukiyar namiji ba shi ne arzikinsa ba. Kyawun halinsa shi ne arziki. Don haka ki fifita kyawun hali wajen zaben mijin aure.",culture_and_religion,wealth and character,public_interest,,safe,true
hausa,latin,Nigeria,Standard,web_public,https://twitter.com/miftahuJikaDala/status/2016108789653499963,2026-01-27,"ALLAH UBANGIJI saboda sirrin dake cikin Daren Isra'i da Mi'iraji, ka buɗe Ƙofofin Arziki, Rahma, Wadata, Suttura, Kwanciyar Hankali da Ɗaukaka garemu don Limamin Mala'iku ANNABI MUHAMMADU RASULILLAHI SALALLAHU ALAIHI WASALLAM Ameen Barkanmu da Warhaka Sharif Jika Dala [URL]",culture_and_religion,Islamic prayer and blessings,public_interest,,safe,true
hausa,latin,Nigeria,Standard,web_public,https://twitter.com/TMInuwa/status/2016089356058919052,2026-01-27,"[USER] [USER] [USER] [USER] [USER] Ta Ina ke da halin arziki sai na tsiyataku ai",livelihoods_and_work,Wealth and lifestyle,public_interest,,safe,true
hausa,latin,Nigeria,Standard,web_public,https://twitter.com/ASHIRUTUKUR17/status/2016088863244992966,2026-01-27,"[USER] [USER] [USER] [USER] [USER] Halin sa na arziki mana",livelihoods_and_work,well-being and prosperity,public_interest,,safe,true
hausa,latin,Nigeria,Kano,web_public,https://twitter.com/amigos_04/status/2016088426223722693,2026-01-27,"[USER] Haba indo toh wai yanzu a tunaninki madugu kansa yana yi dan talaka ne? Noooo shima mafitarsa yake dubawa Madame indo magana a kan talakawa ki ajiye wannan duk yaudara ce talakan arziki a wajen Allah yake nema gaskia",culture_and_religion,discussion of social class,stereotypes,income_level,sensitive,true
hausa,latin,Nigeria,Standard,web_public,https://twitter.com/deezeerhh/status/2016078906680345079,2026-01-27,"Allah kayi mana arziki mai Albarka [URL]",culture_and_religion,religious blessing,public_interest,,safe,true
hausa,latin,Nigeria,Standard,web_public,https://twitter.com/IdrisSuraja2/status/2016077458559140158,2026-01-27,"[USER] Kina da gaskiya sai kije inda babanki yake zama kizaɓo mai arziki kamar babanki",livelihoods_and_work,wealth and family,public_interest,,safe,true
hausa,latin,Nigeria,Kano,web_public,https://twitter.com/RakaFatima/status/2016073586771886348,2026-01-27,"Allah saboda Annabi ﷺ ka hada kan alummar jihar kano. Allah kaita kwararo alkhairai da arziki mara sa iya ka ga jihar kano. [URL]",culture_and_religion,Prayers and blessings,public_interest,,safe,true
hausa,latin,Nigeria,Standard,web_public,https://twitter.com/fateema2233/status/2016070226589216949,2026-01-27,"[USER] se yasa akecewa kuci bashikuyi aure Intazo da arziki sai kubiya",culture_and_religion,marriage and wealth,public_interest,,safe,true
hausa,latin,Nigeria,Standard,web_public,https://twitter.com/Faroukmahuta/status/2016069022685470844,2026-01-27,"Shagon abaya akwai arziki. [URL]",livelihoods_and_work,Wealth and prosperity,public_interest,,safe,true
hausa,latin,Nigeria,Standard,web_public,https://twitter.com/bmjvermerlleey/status/2016066882789372208,2026-01-27,"Haƙiƙa yiwa Ma'aiki Sallallahu alaihi wa Sallama Salati na yayewa bawa damuwa kuma yana taimakawa wajen yalwatar arziki!",culture_and_religion,Importance of praying for the Prophet,public_interest,,safe,true
hausa,latin,Nigeria,Standard,web_public,https://twitter.com/KhaliphaIdris/status/2016057128167817288,2026-01-27,"Amadadin Matasa(Maza da Mata), iyayenmuh da sauran yan uwa da abokan arziki muna jaddada goyon bayanmuh ga mai girma Gwamna Abba K Yusuf ABBA GO AGAIN",governance_civic,Calling for support,public_interest,,safe,true
hausa,latin,Nigeria,Standard,web_public,https://twitter.com/Sir_I_U/status/2016055080215027991,2026-01-27,"[USER] [USER] Allah yakawo kasuwa da arziki mai albarka",culture_and_religion,Blessing and prosperity,public_interest,,safe,true
hausa,latin,Nigeria,Uvira,web_public,https://twitter.com/Mrich072/status/2016707158348353739,2026-01-29,"[USER] Banza werekane aho zari ziparitse Uvira . Mwe mugira propagande yagiswa koko ubwo mwese mwa sharerinze amafoto amwe yose adafite igisobanuro",media_and_online,Propaganda and photos,misinformation,,sensitive,true
hausa,latin,Nigeria,Kano,web_public,https://twitter.com/NonsLizzy/status/2016698385139429406,2026-01-29,"[USER] U enter fest u go see banza",culture_and_religion,festival attendance,stereotypes,,sensitive,true
hausa,latin,Nigeria,Lagos,web_public,https://twitter.com/lion_coker/status/2016686651892707786,2026-01-29,"[USER] [USER] [USER] [USER] Armed Robber when Dem release you from kirikiri, how your Ashawo Mama? She don go nack dogs for lekki to feed I'm imbeciles like you and your Armed Robber papa? Your sister dey have her ARVS? Oloriburuku Banza Ewu-Gambia olodo Barawo make baptize u [USER] [USER]",culture_and_religion,Insults and mockery,hate_or_insult,gender,ethnicity,sensitive,true
hausa,latin,Nigeria,Kano,web_public,https://twitter.com/lion_coker/status/2016686300120662043,2026-01-29,"[USER] [USER] [USER] [USER] Armed Robber when Dem release you from kirikiri, how your Ashawo Mama? She don go nack dogs for lekki to feed I'm imbeciles like you and your Armed Robber papa? Your sister dey have her ARVS? Oloriburuku Banza Ewu-Gambia olodo Barawo make baptize u [USER] [USER]",media_and_online,insults and stereotypes,hate_or_insult,other,sensitive,true
hausa,latin,Nigeria,Standard,web_public,https://twitter.com/Adermz_A/status/2016685572069195937,2026-01-29,"[USER] Kada Allah yasa kiyi shiru, idan kaga dama kayita haushin Kare kamar yacce kasaba. Kasa anata kashe Jamaa bakuyi using audience naku kinyi protesting akai ba sekan wani unnecessary Abun banza. Suma iyan CS din iyan burauba da abin arzikin ne shiru za'ayi sheggu diyan asara.",governance_civic,Advice on protest behavior,public_interest,,sensitive,true
hausa,latin,Nigeria,Standard,web_public,https://twitter.com/jayjayehi/status/2016681398971642303,2026-01-29,"[USER] [USER] [USER] Magana banza ney , terrorist ney wawa",culture_and_religion,Negative commentary,hate_or_insult,ethnicity,sensitive,true
hausa,latin,Nigeria,Kano,web_public,https://twitter.com/fans_bello/status/2016656155456532854,2026-01-28,"[USER] ""Giwa kin fi fako wane mai harbi, ku bar shi ko ya hak'a a banza tarkon nasa "" --Marigayi Mamman Shata-- Allah ya kara maka lafiya da tsawon rai uncle B [USER] [URL]",culture_and_religion,Hunting and trapping,specialized_advice,,safe,true
hausa,latin,Nigeria,Kano,web_public,https://twitter.com/real_bakano/status/2016654319181799680,2026-01-28,"[USER] [USER] Babu abinda Abba gida yayi wa civil servants, biyan albashi banza akan lokaci , time din kwankwaso ana biya, wallahi civil servants su Nan un jiran lokaci. Sai rabawa Yan siyasa Babur na banza. Indai ba waiwayo mu ba wlh sai mun canja.",governance_civic,civil servants' salary payment,public_interest,,safe,true
hausa,latin,Nigeria,Kano,web_public,https://twitter.com/greathszn/status/2016653054888599947,2026-01-28,"[USER] Sportybet don show dem shege banza. [URL]",media_and_online,social media commentary,hate_or_insult,other,sensitive,true
hausa,latin,Nigeria,Standard,web_public,https://twitter.com/AfaruMariam/status/2016649535129317445,2026-01-28,"[USER] [USER] [USER] [USER] [USER] [USER] [USER] [USER] [USER] [USER] [USER] [USER] [USER] He said open latter Dan banza !!!!",household_and_care,Giving instructions,public_interest,,safe,true
hausa,latin,Nigeria,Kano,web_public,https://twitter.com/iamjoyjay/status/2016649508524851653,2026-01-28,"[USER] Dem do shege banza today",culture_and_religion,Insulting behavior,hate_or_insult,tribe,sensitive,true
hausa,latin,Nigeria,Standard,web_public,https://twitter.com/faruck_aleeyu/status/2016649145918841284,2026-01-28,"[USER] Masha Allah. Duk rintsi duk wuya kada ka bari mahaifinka ya zama na banza kun daiji Jamaa. The man did it because of his Dad inda mutinmin banza ne wlh bazaiyi ba. Allah kara daukaka ku damu baki daya. Ameen ya Rahman",culture_and_religion,Blessing and advice,public_interest,,safe,true
hausa,latin,Nigeria,Kano,web_public,https://twitter.com/ChukwuebukaEmj/status/2016646300146471026,2026-01-28,"ENKR, banza, udene bee n'isi ulo gi, igbogbo gbuo gu, akiri taa gu, i bu ezigbo ijiot [URL]",household_and_care,Household and care,stereotypes,gender,sensitive,true
hausa,latin,Nigeria,Kano,web_public,https://twitter.com/Viperh_/status/2016644825584373863,2026-01-28,"Shine gaskiyar magana we are shit… Zuwa anjima zakaga yan Ig su biribiri fede su jude ana ta posting “we will be back stronger” jakan banza. [URL]",media_and_online,Online comments,hate_or_insult,other,sensitive,true
hausa,latin,Nigeria,Standard,web_public,https://twitter.com/Yusuf2918193347/status/2016644622034882970,2026-01-28,"An zo Achi banza banza kuma ta samuuu",livelihoods_and_work,going somewhere,public_interest,,safe,true
hausa,latin,Nigeria,Standard,web_public,https://twitter.com/jayblaque402/status/2016641484468912134,2026-01-28,"[USER] [USER] Shege banza",culture_and_religion,insult,hate_or_insult,other,sensitive,true
hausa,latin,Nigeria,Standard,web_public,https://twitter.com/HALAL_CHASER_/status/2016638938870370568,2026-01-28,"[USER] Allah yasa ba na Banza bane",culture_and_religion,Religious Belief,public_interest,religion,safe,true
hausa,latin,Nigeria,Standard,web_public,https://twitter.com/Sararimuhd/status/2016682583849910403,2026-01-29,"[USER] Kajira lokaci",livelihoods_and_work,time management,public_interest,,safe,true
hausa,latin,Nigeria,Standard,web_public,https://twitter.com/YusuferIbraheem/status/2016663626287861886,2026-01-29,"Wani lokaci sai naji inaji da kaina. Amma idan natuna a Nigeria nake saina Shiga hankalina. [URL]",health,personal experience,public_interest,,safe,true
hausa,latin,Nigeria,Standard,web_public,https://twitter.com/SadiqTuraki004/status/2016644147306770754,2026-01-28,"Lokaci Alkalin kowa [URL]",governance_civic,Time of community leader,public_interest,,safe,true
hausa,latin,Nigeria,Kano,web_public,https://twitter.com/mainanorth/status/2016641023187816743,2026-01-28,"[USER] It Got me Laugh when you are bringing this, Da Sannu lokaci zaizo zamu nuna muku In sha Allah",culture_and_religion,Laughter and appreciation,public_interest,,safe,true
hausa,latin,Nigeria,Standard,web_public,https://twitter.com/ibrahim42694653/status/2016639884568432849,2026-01-28,"[USER] Mujira lokaci dai kawai, amma dai an rufta da yawa fa.. Allah ubangiji ya bamu tsawon rai.",culture_and_religion,time and timing,public_interest,,safe,true
hausa,latin,Nigeria,Kano,web_public,https://twitter.com/senatormaajie/status/2016639240562495554,2026-01-28,"[USER] [USER] Hmmm nipha in nine kwankwaso koh Wlh sena karar da komai nawa dan nakai abba kasa…..abunan shirya shi akai sosai bawai lokaci daya abun yazo bah",governance_civic,Discussion on political figure,public_interest,ethnicity,sensitive,true
hausa,latin,Nigeria,Standard,web_public,https://twitter.com/AMsDtt/status/2016609705410306132,2026-01-28,"[USER] Lokaci Ai na kowa ne.",household_and_care,Time and ownership,public_interest,,safe,true
hausa,latin,Nigeria,Kano,web_public,https://twitter.com/Elbashir57/status/2016604624275279920,2026-01-28,"[USER] Haka take, hk nagani datayi da Christopher Musa, amman wannan lokaci madugun kasa ne, kaga zancen nema yake yazama babba.",livelihoods_and_work,discussion about a person,public_interest,,safe,true
hausa,latin,Nigeria,Standard,web_public,https://twitter.com/dan_mutangwale/status/2016602255844151372,2026-01-28,"[USER] Oga kana lokaci fa",livelihoods_and_work,time,public_interest,,safe,true
hausa,latin,Nigeria,Kano,web_public,https://twitter.com/BoukaryLaminou/status/2016601287542927564,2026-01-28,"[USER] Ni de a CEX nafi samun riba da kwanciyar hankali. DEX kwa na fara yinta yan dalolina suka tsiyaye amma yanzu haka ina analysis lokaci zuwa lokaci domin in kware Kuma shine babban burina a wannan shekarar.",livelihoods_and_work,business and investment,specialized_advice,,safe,true
hausa,latin,Nigeria,Kano,web_public,https://twitter.com/moloofc/status/2016597267449364963,2026-01-28,"[USER] Duk wanda ya bar kwankwaso sai ya Yi danasani watarana ko ba yanzu ba Amma lokaci ne kawai zai nuna haka. Allah ya rufa asiri.",governance_civic,politics and loyalty,misinformation,,sensitive,true
hausa,latin,Nigeria,Standard,web_public,https://twitter.com/ismaelumar2/status/2016583516461424927,2026-01-28,"[USER] Kuna lokaci Oga, Allah ya kara rufa asiri",culture_and_religion,Blessing,public_interest,,safe,true
hausa,latin,Nigeria,Standard,web_public,https://twitter.com/jamstarrrr/status/2016566139476722048,2026-01-28,"I just want to hug every female doctor and tell them that everything will be ok Komai lokaci ne",health,empathy and support,public_interest,gender,sensitive,true
hausa,latin,Nigeria,Standard,web_public,https://twitter.com/Avdolreal/status/2016564620530442669,2026-01-28,"Ae nadan lokaci NE [URL]",household_and_care,time usage,public_interest,,safe,true
hausa,latin,Nigeria,Standard,web_public,https://twitter.com/MIKassim/status/2016564003921637556,2026-01-28,"Lokaci ne Yau ina Bashir Ahmed? [URL]",livelihoods_and_work,asking about location,public_interest,,safe,true
hausa,latin,Nigeria,Standard,web_public,https://twitter.com/MIKassim/status/2016560997176131658,2026-01-28,"Lokaci ne dai. Ku gama [URL]",household_and_care,time and action,public_interest,,safe,true
